,comments_level_1_mid,main_body_uid,发布时间,处理内容,评论地点,mid,点赞数量,原生内容,uid,用户昵称,用户主页,用户描述,用户地理位置,用户性别,用户粉丝数量,用户关注数量,用户全部微博,用户累计评论,用户累计转发,用户累计获赞,用户转评赞
119,5153299162731551,1700720163,25年04月09日 08:58,"回复<a href=/n/我一般是不发评论滴 usercard=""name=@我一般是不发评论滴"">@我一般是不发评论滴</a>:没有租房合同，买家认为他是延迟交房",来自湖北,5153444151167852,0,回复@我一般是不发评论滴:没有租房合同，买家认为他是延迟交房,6317831339,人到中年的九零后,https://weibo.com/u/6317831339,看我会发光,湖北,f,184,33,123,2,2,31,35
120,5153299162731551,1700720163,25年04月09日 08:57,"回复<a href=/n/小白爱吃五花肉 usercard=""name=@小白爱吃五花肉"">@小白爱吃五花肉</a>:我觉得房子过户完成就是新房东的房子了，不然他怎么享受学区待遇",来自广西,5153443891118801,1,回复@小白爱吃五花肉:我觉得房子过户完成就是新房东的房子了，不然他怎么享受学区待遇,2206574015,古兰朵2206574015_636,https://weibo.com/u/2206574015,活成自己喜欢的样子,其他,f,10,80,82,5,2,11,18
121,5153299162731551,1700720163,25年04月09日 08:56,"回复<a href=/n/向睡不醒 usercard=""name=@向睡不醒"">@向睡不醒</a>:但是她这个孩子是在屋里自杀……",来自山东,5153443737769171,1,回复@向睡不醒:但是她这个孩子是在屋里自杀……,5615636651,陌上千秋暖,https://weibo.com/u/5615636651,恭喜发财。,其他,m,53,394,317,73,2,155,230
122,5153299162731551,1700720163,25年04月09日 08:56,"回复<a href=/n/甜壮士 usercard=""name=@甜壮士"">@甜壮士</a>:我也觉得……所有权已经过户完成了，那就已经是新房东的房子了……",来自广西,5153443681666732,39,回复@甜壮士:我也觉得……所有权已经过户完成了，那就已经是新房东的房子了……,2206574015,古兰朵2206574015_636,https://weibo.com/u/2206574015,活成自己喜欢的样子,其他,f,10,80,82,5,2,11,18
123,5153299162731551,1700720163,25年04月09日 08:54,"回复<a href=/n/醉落闲庭- usercard=""name=@醉落闲庭-"">@醉落闲庭-</a>:即便不说其他，就这个事，她肯定得告诉对方。",来自河北,5153443158166077,0,回复@醉落闲庭-:即便不说其他，就这个事，她肯定得告诉对方。,2933569765,只是喜欢罢啦,https://weibo.com/u/2933569765,Dark And Twisted. 三分热度七分凉度，我拿一辈子追求快乐。自尊自爱自强。,北京,f,184,148,627,578,140,"1,401","2,119"
124,5153299162731551,1700720163,25年04月09日 08:54,"回复<a href=/n/粒子距离 usercard=""name=@粒子距离"">@粒子距离</a>:但如果吐痰的是第三人，老板是否还应该退款？现在的房东已事实成为租客，早已不是房东。其实就是看房价跌了，自家孩子也已经享受到学校资源了，且没签租赁合同才来扯的。",来自贵州,5153443103639072,1,回复@粒子距离:但如果吐痰的是第三人，老板是否还应该退款？现在的房东已事实成为租客，早已不是房东。其实就是看房价跌了，自家孩子也已经享受到学校资源了，且没签租赁合同才来扯的。,6183645803,企鹅人卡卡,https://weibo.com/u/6183645803,遥不可及的并非是十年之后，而是今天之前。,其他,f,45,406,1679,293,241,279,813
125,5153299162731551,1700720163,25年04月09日 08:53,谁主张谁举证，没租房合同，没转账明细，法院审判依据就只能是买卖合同，房子过户了交易达成，但是合同内履约完成的时间未到，双方的权利和义务没有完成，有另一个帖子说卖房隐瞒了相关事实，是邻居透露给买方，这不就等于放弃协商机会直接违约了,来自江苏,5153443027354835,0,谁主张谁举证，没租房合同，没转账明细，法院审判依据就只能是买卖合同，房子过户了交易达成，但是合同内履约完成的时间未到，双方的权利和义务没有完成，有另一个帖子说卖房隐瞒了相关事实，是邻居透露给买方，这不就等于放弃协商机会直接违约了,5350023153,大闸蟹跟小虾米,https://weibo.com/u/5350023153,你看到的都是别人想让你看的，意淫要有个限度,江苏 苏州,f,96,115,131,31,1,61,93
