,comments_level_1_mid,main_body_uid,发布时间,处理内容,评论地点,mid,点赞数量,原生内容,uid,用户昵称,用户主页,用户描述,用户地理位置,用户性别,用户粉丝数量,用户关注数量,用户全部微博,用户累计评论,用户累计转发,用户累计获赞,用户转评赞
0,5153299847449471,1700720163,25年04月09日 00:37,我觉得买方向卖方追偿房屋市值损失50-100万差不多，市场跌去的300都加卖主身上不妥，而且买方也享受了学籍。,来自浙江,5153318108136999,24,我觉得买方向卖方追偿房屋市值损失50-100万差不多，市场跌去的300都加卖主身上不妥，而且买方也享受了学籍。,3941998771,怪侠小姐妹,https://weibo.com/u/3941998771,啥都没有,浙江,m,4,3102,48829,44,82,508,634
1,5153299847449471,1700720163,25年04月08日 23:29,产权已经归买家了,来自四川,5153300920930576,15,产权已经归买家了,1935741142,-蒲欣桐,https://weibo.com/u/1935741142,keep calm,四川,f,273,260,613,405,16,382,803
2,5153299847449471,1700720163,25年04月09日 00:45,"跟新房一个流程，开发商卖了房子还没交付状态，约定好什么时候交付什么时候划分产权<img alt=""[摊手]"" title=""[摊手]"" src=""https://face.t.sinajs.cn/t4/appstyle/expression/ext/normal/62/2018new_tanshou_org.png"" />",来自广东,5153320214463999,6,跟新房一个流程，开发商卖了房子还没交付状态，约定好什么时候交付什么时候划分产权[摊手],5201715049,xuanlvhenji,https://weibo.com/u/5201715049,懒癌晚期患者√恨不得连吃都赖在床上√巨蟹？狮子？傻傻分不清√业余学生党√高强力学渣√没想到，以后再补√,广东,f,106,75,197,113,8,183,304
3,5153299847449471,1700720163,25年04月09日 12:06,只看过户就行了？不看合同约定？约定21年过户，22年完全交付，也就是说过户不代表完全交付，在交付前隐瞒凶宅事实，买家就可以说是违约，如果签租赁协议，那就转为租赁合同纠纷，而不是买卖合同纠纷,来自广东,5153491515080874,1,只看过户就行了？不看合同约定？约定21年过户，22年完全交付，也就是说过户不代表完全交付，在交付前隐瞒凶宅事实，买家就可以说是违约，如果签租赁协议，那就转为租赁合同纠纷，而不是买卖合同纠纷,6117650347,栩_歌,https://weibo.com/u/6117650347,,其他,m,31,5,0,0,0,0,0
4,5153299847449471,1700720163,25年04月09日 07:29,租房也不能把房子弄成凶宅吧，你租个车，在车上杀人你看看车主还要不要,来自安徽,5153421910345276,4,租房也不能把房子弄成凶宅吧，你租个车，在车上杀人你看看车主还要不要,6191530490,用户6191530490,https://weibo.com/u/6191530490,,其他,m,35,8,12,5,0,18,23
5,5153299847449471,1700720163,25年04月09日 01:18,过户了还不算卖掉了吗？那把入学资格还回来才公平啊,来自浙江,5153328338043404,7,过户了还不算卖掉了吗？那把入学资格还回来才公平啊,6149136645,米兰的可儿,https://weibo.com/u/6149136645,Festival is the day you beloved.,其他,f,24,730,17603,"1,347",389,687,"2,423"
