,comments_level_1_mid,main_body_uid,发布时间,处理内容,评论地点,mid,点赞数量,原生内容,uid,用户昵称,用户主页,用户认证信息,用户描述,用户地理位置,用户性别,用户粉丝数量,用户关注数量,用户全部微博,用户累计评论,用户累计转发,用户累计获赞,用户转评赞
0,5154920131202547,1850913310,25年04月13日 10:47,这个房子再过几十年都成老破大了，有什么意思？,来自四川,5154921079115800,8,这个房子再过几十年都成老破大了，有什么意思？,1850913310,不神经的神经叨,https://weibo.com/u/1850913310,健康博主,有执业医师证的情感博主,四川,m,111144,87,4758,"68,220","29,418","372,533","470,171"
1,5154920131202547,1850913310,25年04月13日 16:41,"你对真正的医疗费用没啥概念，网上很多这种人，以为治病花几百块就是贵<img alt=""[允悲]"" title=""[允悲]"" src=""https://face.t.sinajs.cn/t4/appstyle/expression/ext/normal/83/2018new_kuxiao_org.png"" />",来自山西,5155010212528210,3,你对真正的医疗费用没啥概念，网上很多这种人，以为治病花几百块就是贵[允悲],7547876584,巨石群星,https://weibo.com/u/7547876584,,,山西 忻州,m,189,539,9156,42,77,346,465
2,5154920131202547,1850913310,25年04月13日 16:22,你不懂，吃中药就意味着放弃治疗吧,来自贵州,5155005543745548,1,你不懂，吃中药就意味着放弃治疗吧,1104860172,优质法官狱中八条,https://weibo.com/u/1104860172,,博士，服务员,其他,m,375,2641,94,13,19,7,39
3,5154920131202547,1850913310,25年04月13日 18:56,"回复<a href=/n/不神经的神经叨 usercard=""name=@不神经的神经叨"">@不神经的神经叨</a>:你说的这种生活就是我曾经梦里的生活，说给我老公听他说这不是咱们普通人想的",来自江西,5155044316154392,0,回复@不神经的神经叨:你说的这种生活就是我曾经梦里的生活，说给我老公听他说这不是咱们普通人想的,5540534389,今天开始关注法师了,https://weibo.com/u/5540534389,,,江西 南昌,f,78,912,928,159,26,195,380
4,5154920131202547,1850913310,25年04月13日 16:57,"回复<a href=/n/奕杉乐乐 usercard=""name=@奕杉乐乐"">@奕杉乐乐</a>:医保范围内能报销。普通病吃不了半年，重病的西药远比中药贵。算了，脑回路不同，理解不了正常。",来自山西,5155014272356459,1,回复@奕杉乐乐:医保范围内能报销。普通病吃不了半年，重病的西药远比中药贵。算了，脑回路不同，理解不了正常。,7547876584,巨石群星,https://weibo.com/u/7547876584,,,山西 忻州,m,189,539,9156,42,77,346,465
5,5154920131202547,1850913310,25年04月13日 16:54,"回复<a href=/n/巨石群星 usercard=""name=@巨石群星"">@巨石群星</a>:一副几十上百，吃个半年一两年呢？",来自广西,5155013563516198,0,回复@巨石群星:一副几十上百，吃个半年一两年呢？,3746715365,奕杉乐乐,https://weibo.com/u/3746715365,,,其他,f,165,716,512,7,11,45,63
6,5154920131202547,1850913310,25年04月13日 15:40,"回复<a href=/n/不神经的神经叨 usercard=""name=@不神经的神经叨"">@不神经的神经叨</a>:叨博，郊区小院是指独栋么",来自北京,5154994873434563,0,回复@不神经的神经叨:叨博，郊区小院是指独栋么,7771476342,听闻远方有你198607,https://weibo.com/u/7771476342,,,北京,f,59,333,7708,51,259,134,444
7,5154920131202547,1850913310,25年04月13日 10:56,"回复<a href=/n/不神经的神经叨 usercard=""name=@不神经的神经叨"">@不神经的神经叨</a>:也是，商品房有寿命的，还是家里的泥冲房冬暖夏凉，古色古香，修修补补也能用。",来自广西,5154923378117776,0,回复@不神经的神经叨:也是，商品房有寿命的，还是家里的泥冲房冬暖夏凉，古色古香，修修补补也能用。,3746715365,奕杉乐乐,https://weibo.com/u/3746715365,,,其他,f,165,716,512,7,11,45,63
