,comments_level_1_mid,main_body_uid,发布时间,处理内容,评论地点,mid,点赞数量,原生内容,uid,用户昵称,用户主页,用户描述,用户地理位置,用户性别,用户粉丝数量,用户关注数量,用户全部微博,用户累计评论,用户累计转发,用户累计获赞,用户转评赞
0,5156584867234929,1959830294,25年04月18日 03:32,那不是这样子的，无论老公有没有本事，被尊重都是人的基本需求,来自广东,5156623741092300,139,那不是这样子的，无论老公有没有本事，被尊重都是人的基本需求,6335672683,大袜子新的,https://weibo.com/u/6335672683,,其他,f,94,354,1595,139,46,166,351
1,5156584867234929,1959830294,25年04月18日 10:57,"人不光需要物质满足，还有精神需求，俗称情绪价值。他妈妈明显没在这个家庭里得到过多正向情绪价值<img alt=""[doge]"" title=""[doge]"" src=""https://face.t.sinajs.cn/t4/appstyle/expression/ext/normal/a1/2018new_doge02_org.png"" />比如两个人的电话，博主更像是教育小孩子一样教育他妈妈",来自山东,5156735568314978,10,人不光需要物质满足，还有精神需求，俗称情绪价值。他妈妈明显没在这个家庭里得到过多正向情绪价值[doge]比如两个人的电话，博主更像是教育小孩子一样教育他妈妈,3559769695,李行险,https://weibo.com/u/3559769695,,其他,m,106,200,123,47,0,70,117
2,5156584867234929,1959830294,25年04月18日 12:51,"这个话虽然不中听，可确实值得警惕。倒不是汪妈妈就是这种人，是要警惕她身边那些阿姨，是不是经常在她面前刷存在感，不服气汪妈妈有个这么能干的儿子，于是只能天天在汪妈妈面前炫耀自己在家里的权威，从而让汪妈妈有些憋屈。我有相同经历，我婆婆以前身边就有这种有毒的友谊<img alt=""[笑cry]"" title=""[笑cry]"" src=""https://face.t.sinajs.cn/t4/appstyle/expression/ext/normal/4a/2018new_xiaoku_thumb.png"" />好在后面都警醒了",来自上海,5156764311880328,0,这个话虽然不中听，可确实值得警惕。倒不是汪妈妈就是这种人，是要警惕她身边那些阿姨，是不是经常在她面前刷存在感，不服气汪妈妈有个这么能干的儿子，于是只能天天在汪妈妈面前炫耀自己在家里的权威，从而让汪妈妈有些憋屈。我有相同经历，我婆婆以前身边就有这种有毒的友谊[笑cry]好在后面都警醒了,1866485495,情来自有安,https://weibo.com/u/1866485495,,海外 其他,f,108,833,1021,13,6,92,111
3,5156584867234929,1959830294,25年04月18日 12:10,这倒也是,来自四川,5156753977379814,0,这倒也是,2853088132,游走的泡芙,https://weibo.com/u/2853088132,僕らはそんな弱くは無い、でも強くも無いから,四川 眉山,f,280,183,4273,"1,364","1,342",597,"3,303"
4,5156584867234929,1959830294,25年04月18日 09:51,这个评价也许符合部分事实，但太不中听了,来自辽宁,5156719151808653,2,这个评价也许符合部分事实，但太不中听了,3220895542,magic_84,https://weibo.com/u/3220895542,用大大的努力和智慧过简单的小日子,辽宁 沈阳,f,98,431,3735,58,32,65,155
5,5156584867234929,1959830294,25年04月18日 11:20,找个对象能力比你强，你就该放低尊严甘心当垫脚石手里的钱被计算得清清楚楚？我看男的找事业型女也软饭硬吃嘛,来自陕西,5156741429069648,6,找个对象能力比你强，你就该放低尊严甘心当垫脚石手里的钱被计算得清清楚楚？我看男的找事业型女也软饭硬吃嘛,2281142252,小钗兔,https://weibo.com/u/2281142252,墙头众多 易入邪教,其他,f,12,291,145,20,0,81,101
