,comments_level_1_mid,main_body_uid,发布时间,处理内容,评论地点,mid,点赞数量,原生内容,uid,用户昵称,用户主页,用户描述,用户地理位置,用户性别,用户粉丝数量,用户关注数量,用户全部微博,用户累计评论,用户累计转发,用户累计获赞,用户转评赞
0,5154304131075158,5484238924,25年04月11日 19:22,我们这如果爹妈留在农村，拼命要叫孩子拿钱回来盖房子跟人家比哈哈哈,来自浙江,5154325999390506,0,我们这如果爹妈留在农村，拼命要叫孩子拿钱回来盖房子跟人家比哈哈哈,5484238924,没啥是不变的,https://weibo.com/u/5484238924,个人吐槽专用，别投诉，换号麻烦。,其他,f,327,598,7397,"1,734","1,083","2,420","5,237"
1,5154304131075158,5484238924,25年04月11日 19:12,"我在想等于我们这小地方人给其中一个孩子在北京买了套房子，哈哈我当时一比较觉得，真是<img alt=""[哈哈]"" title=""[哈哈]"" src=""https://face.t.sinajs.cn/t4/appstyle/expression/ext/normal/8f/2018new_haha_org.png"" /><img alt=""[哈哈]"" title=""[哈哈]"" src=""https://face.t.sinajs.cn/t4/appstyle/expression/ext/normal/8f/2018new_haha_org.png"" /><img alt=""[哈哈]"" title=""[哈哈]"" src=""https://face.t.sinajs.cn/t4/appstyle/expression/ext/normal/8f/2018new_haha_org.png"" />不可能。",来自浙江,5154323521341538,0,我在想等于我们这小地方人给其中一个孩子在北京买了套房子，哈哈我当时一比较觉得，真是[哈哈][哈哈][哈哈]不可能。,5484238924,没啥是不变的,https://weibo.com/u/5484238924,个人吐槽专用，别投诉，换号麻烦。,其他,f,327,598,7397,"1,734","1,083","2,420","5,237"
2,5154304131075158,5484238924,25年04月11日 19:00,我第一次去意大利，住佛罗伦萨一户人家家里，是朋友的客户，老头，没有老太太了，三个儿子两个女儿，住那种大庄园，当然也不是很豪华，他有一个女儿能干，在罗马高收入，他说当时把收入全部给这个女儿买了套公寓，其他孩子和他一起。我当时就觉得人家真舍得，他说不能让孩子在别的城市遭罪。,来自浙江,5154320429354375,0,我第一次去意大利，住佛罗伦萨一户人家家里，是朋友的客户，老头，没有老太太了，三个儿子两个女儿，住那种大庄园，当然也不是很豪华，他有一个女儿能干，在罗马高收入，他说当时把收入全部给这个女儿买了套公寓，其他孩子和他一起。我当时就觉得人家真舍得，他说不能让孩子在别的城市遭罪。,5484238924,没啥是不变的,https://weibo.com/u/5484238924,个人吐槽专用，别投诉，换号麻烦。,其他,f,327,598,7397,"1,734","1,083","2,420","5,237"
3,5154304131075158,5484238924,25年04月11日 19:35,"回复<a href=/n/笔尖上的乐园 usercard=""name=@笔尖上的乐园"">@笔尖上的乐园</a>:我好奇老外子女也不介意一个占那么多爸爸的存款啊，人家认为自己没本事就占老人房子便宜了，倒也是这个理。哈哈",来自浙江,5154329333861932,0,回复@笔尖上的乐园:我好奇老外子女也不介意一个占那么多爸爸的存款啊，人家认为自己没本事就占老人房子便宜了，倒也是这个理。哈哈,5484238924,没啥是不变的,https://weibo.com/u/5484238924,个人吐槽专用，别投诉，换号麻烦。,其他,f,327,598,7397,"1,734","1,083","2,420","5,237"
4,5154304131075158,5484238924,25年04月11日 19:31,"回复<a href=/n/笔尖上的乐园 usercard=""name=@笔尖上的乐园"">@笔尖上的乐园</a>:当然，我们这大部分子女都这样，等着爹妈低头认错，稍微回转一下也好，爹妈觉得孩子不孝不理解自己。哈哈一代又一代都如此。那个黄执中说的，都是委屈怪，凭啥我要付出那么多？哈哈哈",来自浙江,5154328218702517,0,回复@笔尖上的乐园:当然，我们这大部分子女都这样，等着爹妈低头认错，稍微回转一下也好，爹妈觉得孩子不孝不理解自己。哈哈一代又一代都如此。那个黄执中说的，都是委屈怪，凭啥我要付出那么多？哈哈哈,5484238924,没啥是不变的,https://weibo.com/u/5484238924,个人吐槽专用，别投诉，换号麻烦。,其他,f,327,598,7397,"1,734","1,083","2,420","5,237"
5,5154304131075158,5484238924,25年04月11日 19:23,"回复<a href=/n/没啥是不变的 usercard=""name=@没啥是不变的"">@没啥是不变的</a>:我父母就是这样<img alt=""[裂开]"" title=""[裂开]"" src=""https://face.t.sinajs.cn/t4/appstyle/expression/ext/normal/1b/202011_liekai_org.png"" />",来自广东,5154326377141147,0,回复@没啥是不变的:我父母就是这样[裂开],2104160064,笔尖上的乐园,https://weibo.com/u/2104160064,见好，念好！,广东,f,90,59,1615,"2,593",292,638,"3,523"
6,5154304131075158,5484238924,25年04月11日 19:23,"回复<a href=/n/没啥是不变的 usercard=""name=@没啥是不变的"">@没啥是不变的</a>:他拧巴的点就是和父母没有亲密相处的时光，希望父母对他柔软一点，能接纳他尊重他，但是父母一直没看到他的需求<img alt=""[笑cry]"" title=""[笑cry]"" src=""https://face.t.sinajs.cn/t4/appstyle/expression/ext/normal/4a/2018new_xiaoku_thumb.png"" />",来自广东,5154326243708891,0,回复@没啥是不变的:他拧巴的点就是和父母没有亲密相处的时光，希望父母对他柔软一点，能接纳他尊重他，但是父母一直没看到他的需求[笑cry],2104160064,笔尖上的乐园,https://weibo.com/u/2104160064,见好，念好！,广东,f,90,59,1615,"2,593",292,638,"3,523"
7,5154304131075158,5484238924,25年04月11日 19:15,"回复<a href=/n/笔尖上的乐园 usercard=""name=@笔尖上的乐园"">@笔尖上的乐园</a>:所以我说王朔写和妈妈关系那么拧巴，客观说他妈妈不是最烂的，毕竟那个年代拖出去带大她每个月贴120呢，真是大方的，当然王朔的感觉没错他对妈妈的矛盾和炸毛我完全理解，一说话就是想吵架，没法沟通，就像青春期永远不能结束了。",来自浙江,5154324377244754,0,回复@笔尖上的乐园:所以我说王朔写和妈妈关系那么拧巴，客观说他妈妈不是最烂的，毕竟那个年代拖出去带大她每个月贴120呢，真是大方的，当然王朔的感觉没错他对妈妈的矛盾和炸毛我完全理解，一说话就是想吵架，没法沟通，就像青春期永远不能结束了。,5484238924,没啥是不变的,https://weibo.com/u/5484238924,个人吐槽专用，别投诉，换号麻烦。,其他,f,327,598,7397,"1,734","1,083","2,420","5,237"
8,5154304131075158,5484238924,25年04月11日 19:12,"回复<a href=/n/没啥是不变的 usercard=""name=@没啥是不变的"">@没啥是不变的</a>:我好朋友的父母也这么说，住在女儿附近好让女儿安心，同时他们也放心，免得女儿要担心父母需要她的时候使不上力，她们也不用担心女儿一个人远在他乡无依无靠。而我父母和大多数父母都是死死拽住孩子生怕孩子远走高飞，一哭二闹三上吊怎么都要把孩子攥在手里<img alt=""[裂开]"" title=""[裂开]"" src=""https://face.t.sinajs.cn/t4/appstyle/expression/ext/normal/1b/202011_liekai_org.png"" />",来自广东,5154323547555200,0,回复@没啥是不变的:我好朋友的父母也这么说，住在女儿附近好让女儿安心，同时他们也放心，免得女儿要担心父母需要她的时候使不上力，她们也不用担心女儿一个人远在他乡无依无靠。而我父母和大多数父母都是死死拽住孩子生怕孩子远走高飞，一哭二闹三上吊怎么都要把孩子攥在手里[裂开],2104160064,笔尖上的乐园,https://weibo.com/u/2104160064,见好，念好！,广东,f,90,59,1615,"2,593",292,638,"3,523"
