,comments_level_1_mid,main_body_uid,发布时间,处理内容,评论地点,mid,点赞数量,原生内容,uid,用户昵称,用户主页,用户描述,用户地理位置,用户性别,用户粉丝数量,用户关注数量,用户全部微博,用户累计评论,用户累计转发,用户累计获赞,用户转评赞
0,5156435807180778,7069597517,25年04月17日 15:23,谁刻薄都不会是稿主刻薄,来自江苏,5156440121540752,47,谁刻薄都不会是稿主刻薄,6514183224,呦呦蛙吖,https://weibo.com/u/6514183224,道德标杆//关取随意就好//嬷攻有一套的//人不能只喜欢一个人//没关系我爱得要死,其他,f,139,415,3548,531,306,"2,380","3,217"
1,5156435807180778,7069597517,25年04月17日 15:28,她的第一段“自己”是真的指缟纻自己，不是说她妈妈不爱自己🆘🆘缟纻的文字表达让这则投稿歧义好多，人称转换来转换去的影响阅读,来自广东,5156441586139380,9,她的第一段“自己”是真的指缟纻自己，不是说她妈妈不爱自己🆘🆘缟纻的文字表达让这则投稿歧义好多，人称转换来转换去的影响阅读,6193717312,好的好的没关系你说的都将可以,https://weibo.com/u/6193717312,我步伐很慢的，但是有生之年追上你脚步吧,北京,f,92,95,2704,152,21,432,605
2,5156435807180778,7069597517,25年04月17日 15:29,不患寡而患不均，抓着那单单一句话看会有歧义。全篇看下来，稿主更多是感受到了重男轻女所以很痛苦，妈妈努力地工作是因为弟弟。如果她妈妈把钱花在自己身上一些，对所有儿子女儿一视同仁，稿主反而不会投稿,来自上海,5156441607637192,10,不患寡而患不均，抓着那单单一句话看会有歧义。全篇看下来，稿主更多是感受到了重男轻女所以很痛苦，妈妈努力地工作是因为弟弟。如果她妈妈把钱花在自己身上一些，对所有儿子女儿一视同仁，稿主反而不会投稿,6055025169,卡住了_肚肚,https://weibo.com/u/6055025169,肚肚,江苏,f,99,462,324,126,5,335,466
3,5156435807180778,7069597517,25年04月17日 15:19,开题的不爱自己里的自己不是指妈妈自己，而是稿主自己。。。所以才会控诉妈妈没把钱花到稿主身上。。。。,来自安徽,5156439237592820,5,开题的不爱自己里的自己不是指妈妈自己，而是稿主自己。。。所以才会控诉妈妈没把钱花到稿主身上。。。。,6345415770,苏世和一粒米,https://weibo.com/u/6345415770,我只是某档节目，某场直播的观众。,安徽 芜湖,m,23,982,664,133,1,353,487
4,5156435807180778,7069597517,25年04月17日 15:10,通篇都没有看见你到底希望妈妈怎么对自己好，只有你觉得妈妈对你不够好要她供你上大专。她重男轻女，你在吸血上也不遑多让,来自重庆,5156436980269094,1,通篇都没有看见你到底希望妈妈怎么对自己好，只有你觉得妈妈对你不够好要她供你上大专。她重男轻女，你在吸血上也不遑多让,7501762998,很想吃豌杂,https://weibo.com/u/7501762998,老实吃饭 好好睡觉//混沌杂食人，什么都磕只会让我吃饱饱,其他,f,6,333,306,93,6,135,234
5,5156435807180778,7069597517,25年04月17日 15:14,"回复<a href=/n/很想吃豌杂 usercard=""name=@很想吃豌杂"">@很想吃豌杂</a>:你在说什么啊？她还在读书，上大学还是助学贷款，其他费用妈妈让找叔叔要钱，怎么吸血了啊？大学之前养孩子不是她妈妈的义务吗？看到她妈妈这样偏心弟弟怎么就不能控诉一下了",来自浙江,5156438025963190,19,回复@很想吃豌杂:你在说什么啊？她还在读书，上大学还是助学贷款，其他费用妈妈让找叔叔要钱，怎么吸血了啊？大学之前养孩子不是她妈妈的义务吗？看到她妈妈这样偏心弟弟怎么就不能控诉一下了,6634538619,TONGANRMOMO,https://weibo.com/u/6634538619,,其他,f,73,187,1580,442,9,295,746
6,5156435807180778,7069597517,25年04月17日 15:33,"回复<a href=/n/好的好的没关系你说的都将可以 usercard=""name=@好的好的没关系你说的都将可以"">@好的好的没关系你说的都将可以</a>:明白了，我因为前两段对题主想表达的主体有误会",来自重庆,5156442815072409,0,回复@好的好的没关系你说的都将可以:明白了，我因为前两段对题主想表达的主体有误会,7501762998,很想吃豌杂,https://weibo.com/u/7501762998,老实吃饭 好好睡觉//混沌杂食人，什么都磕只会让我吃饱饱,其他,f,6,333,306,93,6,135,234
7,5156435807180778,7069597517,25年04月17日 15:33,"回复<a href=/n/卡住了_肚肚 usercard=""name=@卡住了_肚肚"">@卡住了_肚肚</a>:明白了，我因为前两段对题主想表达的意思有误会",来自重庆,5156442685047931,0,回复@卡住了_肚肚:明白了，我因为前两段对题主想表达的意思有误会,7501762998,很想吃豌杂,https://weibo.com/u/7501762998,老实吃饭 好好睡觉//混沌杂食人，什么都磕只会让我吃饱饱,其他,f,6,333,306,93,6,135,234
8,5156435807180778,7069597517,25年04月17日 15:20,"回复<a href=/n/很想吃豌杂 usercard=""name=@很想吃豌杂"">@很想吃豌杂</a>:？是妹妹考大专的话不供但是会供弟弟啊<img alt=""[疑问]"" title=""[疑问]"" src=""https://face.t.sinajs.cn/t4/appstyle/expression/ext/normal/b8/2018new_ningwen_org.png"" />就这么几个字也看不明白吗",来自河南,5156439339042147,1,回复@很想吃豌杂:？是妹妹考大专的话不供但是会供弟弟啊[疑问]就这么几个字也看不明白吗,5597153044,寤雀,https://weibo.com/u/5597153044,一般路过同人女，我推大于cp，找到下家就带着鸦跑路。移粉咔人是觉得属性相冲不安以及跑路前兆，很温良不轻易咔人 fuck,其他,f,36,589,6213,"1,779",206,"3,055","5,040"
