,main_body_mid,main_body_uid,发布时间,处理内容,评论地点,mid,回复数量,点赞数量,原生内容,uid,用户昵称,用户主页,用户描述,用户地理位置,用户性别,用户粉丝数量,用户关注数量,用户全部微博,用户累计评论,用户累计转发,用户累计获赞,用户转评赞,用户认证信息
44,5155395329593486,1813359803,2025-04-18 10:38:33,"其实总而言之，大家烦的是女主最后恋爱脑爱上了男主，而男主不是个好东西<img alt=""[doge]"" title=""[doge]"" src=""https://face.t.sinajs.cn/t4/appstyle/expression/ext/normal/a1/2018new_doge02_org.png"" />，并且男演员的演技也配得上一句不是好东西<img alt=""[doge]"" title=""[doge]"" src=""https://face.t.sinajs.cn/t4/appstyle/expression/ext/normal/a1/2018new_doge02_org.png"" />。（这剧火还真的是靠母女线顶起来的<img alt=""[允悲]"" title=""[允悲]"" src=""https://face.t.sinajs.cn/t4/appstyle/expression/ext/normal/83/2018new_kuxiao_org.png"" />另外楼里说母亲也迫害女主强行爱女的那位，你至少看剧看完整好吧，你骂骂男拳就行了，别再挑女人苛求了哈）",来自山东,5156730888519900,0,0,其实总而言之，大家烦的是女主最后恋爱脑爱上了男主，而男主不是个好东西[doge]，并且男演员的演技也配得上一句不是好东西[doge]。（这剧火还真的是靠母女线顶起来的[允悲]另外楼里说母亲也迫害女主强行爱女的那位，你至少看剧看完整好吧，你骂骂男拳就行了，别再挑女人苛求了哈）,3218095983,ormorm哇,https://weibo.com/u/3218095983,最怕一生碌碌无为，还安慰自己平凡可贵。,江苏,m,92,36,1484,134,67,351,552,
45,5155395329593486,1813359803,2025-04-17 10:14:23,爱情和家庭是美好的，这个没问题，但前提是，给女主带来美好的这个男人，首先他就是美好的一个人，不需要他随时随地为女主做什么，而是他有着自己的人格魅力，男女主双强互相吸引救赎，不是对女主各种计算各种阴谋各种风月烂事，然后所有恶心的事让女主咽下强行he，还说这就是大女主！,来自广东,5156362413673090,0,0,爱情和家庭是美好的，这个没问题，但前提是，给女主带来美好的这个男人，首先他就是美好的一个人，不需要他随时随地为女主做什么，而是他有着自己的人格魅力，男女主双强互相吸引救赎，不是对女主各种计算各种阴谋各种风月烂事，然后所有恶心的事让女主咽下强行he，还说这就是大女主！,2457004251,会飞的宝宝虫BO,https://weibo.com/u/2457004251,,广东,f,33,24,313,44,11,78,133,
46,5155395329593486,1813359803,2025-04-15 10:56:25,那这么说那这么说还不如有些短剧的立意啊。有几部重生复仇，那就是利用资源嘎嘎乱杀，送渣男下地狱，拿着资产逍遥自在,来自江苏,5155648216238875,0,0,那这么说那这么说还不如有些短剧的立意啊。有几部重生复仇，那就是利用资源嘎嘎乱杀，送渣男下地狱，拿着资产逍遥自在,5817354934,重度精分,https://weibo.com/u/5817354934,,北京,f,81,31,1924,264,43,548,855,
47,5155395329593486,1813359803,2025-04-15 09:17:15,古偶剧就不要扯什么古代现实了，这个编剧避而不谈自己那些言论特会给自己扯高帽，扯什么现实啊我倒想问问古代现实这个反派爹怎么杀的了女主妈和那个初恋的啊，官方驿站没管理者的吗？正二品高官辞官回乡身边没下人的吗？一个中年七品文官一个人就能杀完这么多人还不会引起朝议是吧,来自浙江,5155623265108317,0,6,古偶剧就不要扯什么古代现实了，这个编剧避而不谈自己那些言论特会给自己扯高帽，扯什么现实啊我倒想问问古代现实这个反派爹怎么杀的了女主妈和那个初恋的啊，官方驿站没管理者的吗？正二品高官辞官回乡身边没下人的吗？一个中年七品文官一个人就能杀完这么多人还不会引起朝议是吧,7165482753,度呵呵踩水,https://weibo.com/u/7165482753,,其他,m,124,397,4847,124,213,"1,630","1,967",
48,5155395329593486,1813359803,2025-04-14 18:41:19,看完描述就是爽版娘道嘛，以为自己两边都讨好到了，这个报仇的高度烈度还不如明清小说,来自北京,5155402825862426,0,9,看完描述就是爽版娘道嘛，以为自己两边都讨好到了，这个报仇的高度烈度还不如明清小说,1409162241,打开时偶尔,https://weibo.com/u/1409162241,事情发生后就没有真相了；请不必礼貌性回关；评论有提示但经常刷不到,北京 东城区,f,170,543,32772,"2,197","9,329","1,907","13,433",
