,main_body_mid,main_body_uid,发布时间,处理内容,评论地点,mid,回复数量,点赞数量,原生内容,uid,用户昵称,用户主页,用户描述,用户地理位置,用户性别,用户粉丝数量,用户关注数量,用户全部微博,用户累计评论,用户累计转发,用户累计获赞,用户转评赞,用户认证信息
0,5155395329593486,1813359803,2025-04-14 18:58:23,"抛开男女主线不谈，这部剧的所谓女性联盟也写得很牵强，强行爱女啊<img alt=""[笑cry]"" title=""[笑cry]"" src=""https://face.t.sinajs.cn/t4/appstyle/expression/ext/normal/4a/2018new_xiaoku_thumb.png"" />，女主遭受的迫害明明有来自母亲的一份，但她就天然体谅甚至要去保护母亲，不违背基本人性么？女主母亲一开始想把庄家拖到满门抄斩的时候怎么没说自己其实不恨小妾，后期又强行结盟。",来自中国台湾,5155407119520414,51,272,抛开男女主线不谈，这部剧的所谓女性联盟也写得很牵强，强行爱女啊[笑cry]，女主遭受的迫害明明有来自母亲的一份，但她就天然体谅甚至要去保护母亲，不违背基本人性么？女主母亲一开始想把庄家拖到满门抄斩的时候怎么没说自己其实不恨小妾，后期又强行结盟。,6230289583,苏苓sonate,https://weibo.com/u/6230289583,虚室生白,其他,f,432,575,7467,"4,587","7,600","19,612","31,799",
1,5155395329593486,1813359803,2025-04-15 08:06:54,"《掌心》不用跟谁对比 单拎出来看也是非常好的女本位作品啊 不要说得好像它也不咋地只是比另一个强一些而已好吗<img alt=""[揣手]"" title=""[揣手]"" src=""https://face.t.sinajs.cn/t4/appstyle/expression/ext/normal/af/2022_chuaishou_org.png"" />近五年甚至十年能找出一个从女主到女配都完全不谈恋爱不在意性缘的女频古装吗 何况主线剧情还写得这么好 女频权谋也是独一份了吧",来自黑龙江,5155605556757906,20,155,《掌心》不用跟谁对比 单拎出来看也是非常好的女本位作品啊 不要说得好像它也不咋地只是比另一个强一些而已好吗[揣手]近五年甚至十年能找出一个从女主到女配都完全不谈恋爱不在意性缘的女频古装吗 何况主线剧情还写得这么好 女频权谋也是独一份了吧,5290218258,两只阿懒,https://weibo.com/u/5290218258,海浪拍岸，纷纷碎裂。,其他,f,2991,613,19599,"49,088","64,106","109,030","222,224",
2,5155395329593486,1813359803,2025-04-14 18:38:07,现在很多剧都太注重说教或者喊口号式女权（国色芳华，念无双），有些剧里角色的行为和女权，更甚者做人的道德底线背道而驰（长月烬明女二）。掌心前期挺好，不知道为什么就是看不下去,来自澳大利亚,5155402019507001,62,74,现在很多剧都太注重说教或者喊口号式女权（国色芳华，念无双），有些剧里角色的行为和女权，更甚者做人的道德底线背道而驰（长月烬明女二）。掌心前期挺好，不知道为什么就是看不下去,2180064315,爱吃西瓜的花心观众,https://weibo.com/u/2180064315,懒惰观众一枚。,上海 闸北区,f,10,116,5927,843,184,"3,287","4,314",
3,5155395329593486,1813359803,2025-04-14 20:36:56,因为庄寒雁在剧里有一段台词，讨论女人为什么要嫁人，在庄寒雁的想法里，嫁人是女人为自己找一个栖身之所，因为那种社会容不得女人不嫁人，自己的家庭也没有她的容身之处。她从不认为嫁人就有了依靠，但至少她可以争取选择嫁给自己能掌控的人。,来自广西,5155431920698792,91,31,因为庄寒雁在剧里有一段台词，讨论女人为什么要嫁人，在庄寒雁的想法里，嫁人是女人为自己找一个栖身之所，因为那种社会容不得女人不嫁人，自己的家庭也没有她的容身之处。她从不认为嫁人就有了依靠，但至少她可以争取选择嫁给自己能掌控的人。,1135142283,鱼好秋,https://weibo.com/u/1135142283,爱剑三，爱汉服，爱布袋戏,广西 南宁,f,643,862,9749,"6,333","15,994","22,263","44,590",
4,5155395329593486,1813359803,2025-04-14 21:41:03,这部剧都能跟掌心比了吗？,来自江苏,5155448056710349,9,96,这部剧都能跟掌心比了吗？,1741994785,江北影视风向标,https://weibo.com/u/1741994785,热血老青年,江苏 南京,f,417,440,16624,"5,715","2,589","33,431","41,735",
5,5155395329593486,1813359803,2025-04-14 19:32:00,掌心是特别好的一部，所有女角色都有独立的人格，非常难得,来自浙江,5155415580478741,0,77,掌心是特别好的一部，所有女角色都有独立的人格，非常难得,1490792342,消失的99要奋斗,https://weibo.com/u/1490792342,,香港 其他,f,544,305,2044,"1,659",687,"2,438","4,784",
6,5155395329593486,1813359803,2025-04-14 20:10:16,掌心结局掌自己的心看的神清气爽,来自上海,5155425209553837,0,62,掌心结局掌自己的心看的神清气爽,2843806204,laylaybrulee,https://weibo.com/u/2843806204,Hi,上海,f,353,3174,16528,"1,662","5,151","4,357","11,170",
7,5155395329593486,1813359803,2025-04-14 18:32:08,"掌心确实很赞<img alt=""[good]"" title=""[good]"" src=""https://face.t.sinajs.cn/t4/appstyle/expression/ext/normal/8a/2018new_good_org.png"" />",来自广东,5155400513489419,0,58,掌心确实很赞[good],1977063807,三颗猫饼干LIN,https://weibo.com/u/1977063807,,广东 汕头,f,224,891,2920,929,86,969,"1,984",
8,5155395329593486,1813359803,2025-04-14 23:51:18,掌心可不止做到了女性独立与智慧，还做到了女性和男性角色可以平等的争权夺利，权势不再是男性独有，女性不再拘泥宅院情爱，还有每个大大小小角色都鲜活又立体，每个角色都是她自己人生的主角,来自湖南,5155480835722550,0,60,掌心可不止做到了女性独立与智慧，还做到了女性和男性角色可以平等的争权夺利，权势不再是男性独有，女性不再拘泥宅院情爱，还有每个大大小小角色都鲜活又立体，每个角色都是她自己人生的主角,3046058845,树和猫咪和胡萝卜的好天气,https://weibo.com/u/3046058845,这一生愿平凡快乐……,福建 厦门,f,306,612,14641,"2,417","1,810","13,782","18,009",
9,5155395329593486,1813359803,2025-04-15 06:56:01,觉醒的女性都不会进后宅的望周知。最后还是要钻后宅的算什么觉醒哈哈哈哈😄又是♂对“觉醒女性”的无知幻想，搞得女主前后矛盾，伪人似的,来自广东,5155587718645077,1,29,觉醒的女性都不会进后宅的望周知。最后还是要钻后宅的算什么觉醒哈哈哈哈😄又是♂对“觉醒女性”的无知幻想，搞得女主前后矛盾，伪人似的,6405521899,人间四月芳菲兔,https://weibo.com/u/6405521899,,四川,f,81,207,6252,392,279,990,"1,661",
10,5155395329593486,1813359803,2025-04-15 09:10:50,牟哥给男编剧洗涤的爱楠宝真是够了。大家骂也是骂某些剧情人设。她就非得护着烂黄瓜人社是吧。不说远的。就最近的剧《山花烂漫时》合《热辣滚烫》里的女主可不会爱上烂黄瓜，而且主线是理想，而不是和男的这个那个，最后自己家都死完了，男主家还人口密集呢，就这设定,来自广东,5155621645584622,4,14,牟哥给男编剧洗涤的爱楠宝真是够了。大家骂也是骂某些剧情人设。她就非得护着烂黄瓜人社是吧。不说远的。就最近的剧《山花烂漫时》合《热辣滚烫》里的女主可不会爱上烂黄瓜，而且主线是理想，而不是和男的这个那个，最后自己家都死完了，男主家还人口密集呢，就这设定,6405521899,人间四月芳菲兔,https://weibo.com/u/6405521899,,四川,f,81,207,6252,392,279,990,"1,661",
11,5155395329593486,1813359803,2025-04-14 19:04:44,这剧的起承转合特别像短视频，强行反转，不合情理和逻辑。,来自湖北,5155408717549188,0,37,这剧的起承转合特别像短视频，强行反转，不合情理和逻辑。,1576087132,影遥,https://weibo.com/u/1576087132,,湖北 武汉,f,218,282,5694,275,349,318,942,二级 心理咨询师
12,5155395329593486,1813359803,2025-04-14 18:25:53,这剧的感情线真是令人迷惑，而且男主演的也太木了，让他做个镶边工具人不好么（。）大结局那个真是让人迷惑，还不如让阿芝归母姓，幸存的大家快快乐乐养孩子,来自广东,5155398945080662,1,14,这剧的感情线真是令人迷惑，而且男主演的也太木了，让他做个镶边工具人不好么（。）大结局那个真是让人迷惑，还不如让阿芝归母姓，幸存的大家快快乐乐养孩子,2179655300,躺平有什么不好的呢,https://weibo.com/u/2179655300,单纯喜欢随便点点，没别的意思。,广东 惠州,f,150,374,4392,"3,139",583,656,"4,378",
13,5155395329593486,1813359803,2025-04-15 07:53:09,"女主历经千难万险，最后给自己找了个男的<img alt=""[二哈]"" title=""[二哈]"" src=""https://face.t.sinajs.cn/t4/appstyle/expression/ext/normal/22/2018new_erha_org.png"" />",来自上海,5155602099863748,1,11,女主历经千难万险，最后给自己找了个男的[二哈],3221856730,咪呜喵呜嗷嗷呜,https://weibo.com/u/3221856730,爱猫爱吃鱼。,其他,f,136,1887,8501,744,"1,093","1,140","2,977",
14,5155395329593486,1813359803,2025-04-15 13:59:24,《滤镜》的逻辑也很奇怪，女主从小一直被家里和外面的人话里话外的嫌丑，然后面试和同学会被各种外貌羞辱和歧视之后，归因竟然是女主自己不自信，自己误会了，自己太重视外貌了，完全不提一直以来遭遇的不好的对待，最后又上演男主识破滤镜爱上你和相亲相爱一家人戏码，之前的伤害只字不提，女主全责,来自北京,5155694266288578,0,3,《滤镜》的逻辑也很奇怪，女主从小一直被家里和外面的人话里话外的嫌丑，然后面试和同学会被各种外貌羞辱和歧视之后，归因竟然是女主自己不自信，自己误会了，自己太重视外貌了，完全不提一直以来遭遇的不好的对待，最后又上演男主识破滤镜爱上你和相亲相爱一家人戏码，之前的伤害只字不提，女主全责,1846940143,喜欢飞啊飞啊飞的鱼,https://weibo.com/u/1846940143,吃货改变世界,北京 丰台区,f,156,606,18150,"15,037","3,885","1,596","20,518",
15,5155395329593486,1813359803,2025-04-15 09:26:16,博主说的真好，这编剧感觉就是有什么奇怪的xp喜欢夹带二婚男的私货,来自天津,5155625528985067,0,9,博主说的真好，这编剧感觉就是有什么奇怪的xp喜欢夹带二婚男的私货,2167203241,陈杰苏,https://weibo.com/u/2167203241,,海外 其他,m,915,3924,38101,"3,647","78,965","8,421","91,033",
16,5155395329593486,1813359803,2025-04-14 18:25:07,完全同意👍,来自湖南,5155398749003668,0,2,完全同意👍,5827488469,今天也元气满满啊,https://weibo.com/u/5827488469,"东  ,    榆",其他,m,174,2169,4435,391,37,978,"1,406",
17,5155395329593486,1813359803,2025-04-14 19:12:09,点了,来自江苏,5155410584537679,0,1,点了,7053059249,今天也要名列前茅呀,https://weibo.com/u/7053059249,,其他,m,17,281,656,76,4,130,210,
18,5155395329593486,1813359803,2025-04-15 10:21:57,"<a href=/n/以吻封疆 usercard=""name=@以吻封疆"">@以吻封疆</a> 我好像看了部假的雁回时。",来自江苏,5155639543992790,1,1,@以吻封疆 我好像看了部假的雁回时。,7736596912,清泥梨汁,https://weibo.com/u/7736596912,等七月,山东,f,1460,782,9876,"54,794","14,297","90,007","159,098",
19,5155395329593486,1813359803,2025-04-17 11:01:05,"国产爱情就不存在什么觉醒救赎成长<img alt=""[二哈]"" title=""[二哈]"" src=""https://face.t.sinajs.cn/t4/appstyle/expression/ext/normal/22/2018new_erha_org.png"" />",来自江苏,5156374166901049,0,0,国产爱情就不存在什么觉醒救赎成长[二哈],6585215495,骨烣应该撒进海里,https://weibo.com/u/6585215495,我永远爱阿花,黑龙江 绥化,m,38,674,5510,387,942,807,"2,136",
20,5155395329593486,1813359803,2025-04-17 05:23:06,我最不理解的是女主从小在那么变态的环境中长大，竟然长成了一个精神稳定内核强大的人，令人敬佩。,来自安徽,5156289109819515,0,0,我最不理解的是女主从小在那么变态的环境中长大，竟然长成了一个精神稳定内核强大的人，令人敬佩。,7058187182,长短蝶,https://weibo.com/u/7058187182,关于一些服饰,江苏 南京,f,65,292,375,83,174,136,393,
21,5155395329593486,1813359803,2025-04-16 09:12:05,"<a href=/n/因为我是昭妍啊 usercard=""name=@因为我是昭妍啊"">@因为我是昭妍啊</a> 权谋厉害 但是男主实在不值得被爱",来自湖南,5155984347762408,0,0,@因为我是昭妍啊 权谋厉害 但是男主实在不值得被爱,6630597315,叮叮咚咚嘻嘻哈哈呜哩哇啦,https://weibo.com/u/6630597315,Zp家的小宝贝儿~,湖南,f,39,560,2813,481,17,249,747,
22,5155395329593486,1813359803,2025-04-15 18:23:55,没错,来自湖南,5155760834614486,0,0,没错,6100217650,鸢槿桑晚,https://weibo.com/u/6100217650,哈哈哈哈哈哈,浙江 杭州,f,92,1434,4534,179,236,"4,397","4,812",
23,5155395329593486,1813359803,2025-04-15 11:14:29,"笑话一则：女权男<img alt=""[太开心]"" title=""[太开心]"" src=""https://face.t.sinajs.cn/t4/appstyle/expression/ext/normal/1e/2018new_taikaixin_org.png"" />",来自新疆,5155652763387528,0,1,笑话一则：女权男[太开心],7481043670,思君万里馀waner,https://weibo.com/u/7481043670,纷纷姊妹尽华裙，顾我何忧彻骨贫。不见梅花亭外立，西风岭上好精神。,天津,f,86,294,420,214,121,494,829,
24,5155395329593486,1813359803,2025-04-16 00:26:47,掌心的立意那是完全民本位 女性主义从头到尾都塑造得很完整 不要那这部剧和我们掌心比了 立意上完全比不了,来自福建,5155852153259677,0,2,掌心的立意那是完全民本位 女性主义从头到尾都塑造得很完整 不要那这部剧和我们掌心比了 立意上完全比不了,3816651753,我的喵是可乐,https://weibo.com/u/3816651753,吃货，路痴，没心没肺,福建 福州,f,253,448,3198,563,49,"7,220","7,832",
25,5155395329593486,1813359803,2025-04-15 19:32:01,写得真好，但凡将女性绑在男人身边（爱情、婚姻、生育、家庭）都令人作呕,来自浙江,5155777971226884,0,4,写得真好，但凡将女性绑在男人身边（爱情、婚姻、生育、家庭）都令人作呕,7951235204,老女人之声,https://weibo.com/u/7951235204,谢绝男性关注,北京,f,2654,371,478,"1,456","10,293","34,813","46,562",
26,5155395329593486,1813359803,2025-04-18 07:32:22,"从第三段开始我就看懂你的论点根本就不是雁回时了<img alt=""[开学季]"" title=""[开学季]"" src=""https://face.t.sinajs.cn/t4/appstyle/expression/ext/normal/72/2021_kaixueji_org.png"" />",来自上海,5156684030019436,0,0,从第三段开始我就看懂你的论点根本就不是雁回时了[开学季],5289772567,Balsamandpear,https://weibo.com/u/5289772567,这破账号啥都发。,江苏,f,131,315,1415,"1,810",58,"2,971","4,839",
27,5155395329593486,1813359803,2025-04-16 09:15:24,怎么会有人相信男编剧能写出女本位的剧，面对剧情的缺陷上蹿下跳的脑补编剧多爱女，发疯一样骂质疑为什么要给女主安排二婚带娃姐夫当男主的观众不是真大女主真女权，真大女主必须能接受这样的人男主。,来自美国,5155985183475173,0,0,怎么会有人相信男编剧能写出女本位的剧，面对剧情的缺陷上蹿下跳的脑补编剧多爱女，发疯一样骂质疑为什么要给女主安排二婚带娃姐夫当男主的观众不是真大女主真女权，真大女主必须能接受这样的人男主。,5058093335,missionspace,https://weibo.com/u/5058093335,,海外,f,42,164,64,18,2,128,148,
28,5155395329593486,1813359803,2025-04-16 00:28:09,我们掌心在塑造女性时可不会削弱男性和反派角色的智商,来自福建,5155852499812377,0,0,我们掌心在塑造女性时可不会削弱男性和反派角色的智商,3816651753,我的喵是可乐,https://weibo.com/u/3816651753,吃货，路痴，没心没肺,福建 福州,f,253,448,3198,563,49,"7,220","7,832",
29,5155395329593486,1813359803,2025-04-15 21:02:05,不如九义人 真的女性互助 也有男的帮忙但都不是爱情,来自山东,5155800636982865,0,1,不如九义人 真的女性互助 也有男的帮忙但都不是爱情,7732275344,涮肉坊白掌柜,https://weibo.com/u/7732275344,很喜欢她唉,云南 西双版纳,m,64,185,2952,299,61,"1,119","1,479",
30,5155395329593486,1813359803,2025-04-15 18:32:25,就是硬蹭，从播剧的时候就编剧编剧，中国编剧这么厉害就不能直接原创剧本嘛，老是买个小说在原有的基础上改改改，吃些时代变更红利,来自江苏,5155762972656629,0,0,就是硬蹭，从播剧的时候就编剧编剧，中国编剧这么厉害就不能直接原创剧本嘛，老是买个小说在原有的基础上改改改，吃些时代变更红利,7728777869,冰儿35180,https://weibo.com/u/7728777869,,其他,m,4,240,6,0,0,0,0,
31,5155395329593486,1813359803,2025-04-15 18:12:45,这剧也配和掌心比,来自新疆,5155758023640547,0,2,这剧也配和掌心比,5227077596,一只幸运句号,https://weibo.com/u/5227077596,精通阉割术，网络手术大师,其他,f,105,1638,5999,"1,571",182,"7,117","8,870",
32,5155395329593486,1813359803,2025-04-15 17:08:37,我们掌心偏权谋，没有大家爱看的男女主感情纠葛，但是剧情牛牛的，女主完成自我救赎更是吊打伪大女主,来自湖北,5155741888414051,0,2,我们掌心偏权谋，没有大家爱看的男女主感情纠葛，但是剧情牛牛的，女主完成自我救赎更是吊打伪大女主,1842568790,初心Elena,https://weibo.com/u/1842568790,随便看看,湖北 咸宁,f,546,1594,6928,680,764,"3,106","4,550",
33,5155395329593486,1813359803,2025-04-15 14:33:27,潮水褪去才知道谁在裸泳,来自江苏,5155702834987743,0,0,潮水褪去才知道谁在裸泳,7855817988,ss治愈一切,https://weibo.com/u/7855817988,,其他,f,4,65,144,104,6,154,264,
34,5155395329593486,1813359803,2025-04-15 13:08:00,"我觉得这部剧就是爽剧的爽点+短剧式的情绪调动在吸引人，剧情内容还有主角演技是经不起推敲的<img alt=""[笑cry]"" title=""[笑cry]"" src=""https://face.t.sinajs.cn/t4/appstyle/expression/ext/normal/4a/2018new_xiaoku_thumb.png"" /><img alt=""[笑cry]"" title=""[笑cry]"" src=""https://face.t.sinajs.cn/t4/appstyle/expression/ext/normal/4a/2018new_xiaoku_thumb.png"" /><img alt=""[笑cry]"" title=""[笑cry]"" src=""https://face.t.sinajs.cn/t4/appstyle/expression/ext/normal/4a/2018new_xiaoku_thumb.png"" />可能得罪人了，但是咱得实话实说<img alt=""[允悲]"" title=""[允悲]"" src=""https://face.t.sinajs.cn/t4/appstyle/expression/ext/normal/83/2018new_kuxiao_org.png"" />",来自江苏,5155681331317238,0,1,我觉得这部剧就是爽剧的爽点+短剧式的情绪调动在吸引人，剧情内容还有主角演技是经不起推敲的[笑cry][笑cry][笑cry]可能得罪人了，但是咱得实话实说[允悲],7509212217,温顺的皮吐槽的心,https://weibo.com/u/7509212217,,江苏,f,10,517,1084,295,14,"2,254","2,563",
35,5155395329593486,1813359803,2025-04-15 12:43:58,最离谱的是这部剧的宣发，中后期全力推男女主cp，完全无视剧有点热度靠的什么，妄图把木到发丑的男主抬成流量,来自山东,5155675282605836,0,0,最离谱的是这部剧的宣发，中后期全力推男女主cp，完全无视剧有点热度靠的什么，妄图把木到发丑的男主抬成流量,6311924400,六倍速龙卷风,https://weibo.com/u/6311924400,,其他,f,25,172,563,91,3,217,311,
36,5155395329593486,1813359803,2025-04-15 12:14:34,"现在的爽剧已经不能带脑子了，纯爽。<img alt=""[揣手]"" title=""[揣手]"" src=""https://face.t.sinajs.cn/t4/appstyle/expression/ext/normal/af/2022_chuaishou_org.png"" />",来自河南,5155667884640187,0,0,现在的爽剧已经不能带脑子了，纯爽。[揣手],1076551400,云云叨叨,https://weibo.com/u/1076551400,在叨叨的过程中 云朵飘过 任时光飞逝 于是 看到未来,其他,f,400,103,2561,"1,152",204,"1,807","3,163",
37,5155395329593486,1813359803,2025-04-15 00:03:35,"天呐 江照黎明前面几集和后面超级割裂<img alt=""[笑cry]"" title=""[笑cry]"" src=""https://face.t.sinajs.cn/t4/appstyle/expression/ext/normal/4a/2018new_xiaoku_thumb.png"" /><img alt=""[笑cry]"" title=""[笑cry]"" src=""https://face.t.sinajs.cn/t4/appstyle/expression/ext/normal/4a/2018new_xiaoku_thumb.png"" />烂尾到我现在还对这个剧有阴影<img alt=""[二哈]"" title=""[二哈]"" src=""https://face.t.sinajs.cn/t4/appstyle/expression/ext/normal/22/2018new_erha_org.png"" />又是他！真的避雷了<img alt=""[笑cry]"" title=""[笑cry]"" src=""https://face.t.sinajs.cn/t4/appstyle/expression/ext/normal/4a/2018new_xiaoku_thumb.png"" />",来自河北,5155483925614291,0,1,天呐 江照黎明前面几集和后面超级割裂[笑cry][笑cry]烂尾到我现在还对这个剧有阴影[二哈]又是他！真的避雷了[笑cry],6333071351,瓜田里面没有猹,https://weibo.com/u/6333071351,,其他,m,10,39,713,738,33,648,"1,419",
38,5155395329593486,1813359803,2025-04-15 13:44:37,确实要是跟隔壁掌心一样，两人联手办事，完活各回各家也不至于创飞这么多人，这个剧给人一种既要又要左右互搏的割裂感，女主从自强自立不求男女之情变成了相夫教子的封建主母，真的荒唐。,来自四川,5155690545681024,1,3,确实要是跟隔壁掌心一样，两人联手办事，完活各回各家也不至于创飞这么多人，这个剧给人一种既要又要左右互搏的割裂感，女主从自强自立不求男女之情变成了相夫教子的封建主母，真的荒唐。,7984884221,芙洛西,https://weibo.com/u/7984884221,,其他,f,0,0,0,0,0,0,0,
39,5155395329593486,1813359803,2025-04-14 19:59:56,庄寒雁嫁男主是权宜之计啊，后面男主能给她想要的自然就留下来了，我觉得没毛病诶，后面如果男主做了不利于她的事儿，庄寒雁第一个刀他，这么有主观能动性的女主还不算大女主吗？,来自湖北,5155422609610534,2,17,庄寒雁嫁男主是权宜之计啊，后面男主能给她想要的自然就留下来了，我觉得没毛病诶，后面如果男主做了不利于她的事儿，庄寒雁第一个刀他，这么有主观能动性的女主还不算大女主吗？,6113314137,栀子柠檬椰,https://weibo.com/u/6113314137,,其他,f,0,32,33,8,1,13,22,
40,5155395329593486,1813359803,2025-04-15 22:31:13,我说差不多得了 嘴里抱怨  但其实你们就是喜欢这款加了💩的风味 你们被异化到不加💩不爱吃 就算了 怎么还踩上掌心了 不太配吧,来自澳大利亚,5155823068909348,0,0,我说差不多得了 嘴里抱怨  但其实你们就是喜欢这款加了💩的风味 你们被异化到不加💩不爱吃 就算了 怎么还踩上掌心了 不太配吧,5581419750,长灯明澈,https://weibo.com/u/5581419750,得我亲近 才可共我哭泣 （镇魂）,海外 澳大利亚,m,0,122,469,420,93,230,743,
41,5155395329593486,1813359803,2025-04-15 21:16:01,这片子的母女线在我眼里也不过是把早古霸总强制爱虐文套路硬加在母女上的狗屎。麻烦不要这样玷污母女感情。,来自福建,5155804145260021,0,0,这片子的母女线在我眼里也不过是把早古霸总强制爱虐文套路硬加在母女上的狗屎。麻烦不要这样玷污母女感情。,7686686013,猫白meowhite,https://weibo.com/u/7686686013,不关心热搜上的人类。,其他,f,4,29,358,33,37,232,302,
42,5155395329593486,1813359803,2025-04-15 15:47:22,女主和现代人的思维怎么可能一样，她可没有男权女权的意识，她只知道她命运的悲剧源于自己的父亲。她反抗的是自己的父亲，而不是男性。,来自陕西,5155721436465566,0,1,女主和现代人的思维怎么可能一样，她可没有男权女权的意识，她只知道她命运的悲剧源于自己的父亲。她反抗的是自己的父亲，而不是男性。,6292230609,龙腾盛世08376,https://weibo.com/u/6292230609,,北京,m,54,264,46,10,0,15,25,
43,5155395329593486,1813359803,2025-04-14 23:31:06,"？？女主结婚仅仅是为了复仇，而且男主甘愿为女主利用，你是看不到？<img alt=""[汗]"" title=""[汗]"" src=""https://face.t.sinajs.cn/t4/appstyle/expression/ext/normal/28/2018new_han_org.png"" />",来自河南,5155475751175736,7,0,？？女主结婚仅仅是为了复仇，而且男主甘愿为女主利用，你是看不到？[汗],7509250004,-语棠-LYXT,https://weibo.com/u/7509250004,打游戏，喜欢二游，看动漫和电视剧比较挑，动漫看精致度和剧情，电视剧看服化道，剧情。电视剧不常看,河南,f,19,60,10,15,1,11,27,
