,main_body_mid,main_body_uid,发布时间,处理内容,评论地点,mid,回复数量,点赞数量,原生内容,uid,用户昵称,用户主页,用户认证信息,用户描述,用户地理位置,用户性别,用户粉丝数量,用户关注数量,用户全部微博,用户累计评论,用户累计转发,用户累计获赞,用户转评赞
146,5084351758860761,5569557656,2024-09-30 17:19:18,唐漾作为女性职场精英，清醒、知世故，不受利诱唆,来自江西,5084354166653054,0,0,唐漾作为女性职场精英，清醒、知世故，不受利诱唆,2437441715,金豆果果,https://weibo.com/u/2437441715,,Mary  Kay,江苏 常州,f,114,1126,10338,234,17,252,503
147,5084351758860761,5569557656,2024-09-30 17:19:18,知性清醒女主职场交锋真实到位,来自广东,5084354164819127,0,0,知性清醒女主职场交锋真实到位,5607844727,叫我张小妍,https://weibo.com/u/5607844727,,裱花师一枚,陕西 宝鸡,f,106,887,10184,114,17,139,270
148,5084351758860761,5569557656,2024-09-30 17:19:17,女主职场交锋真实刺激，清醒大女主处理职场挑战，让人深有触动,来自浙江,5084354160362678,0,0,女主职场交锋真实刺激，清醒大女主处理职场挑战，让人深有触动,3479894232,L0L丹儿,https://weibo.com/u/3479894232,,真正的爱情 需要陪伴的！,广西 南宁,f,627,2179,13307,101,4,293,398
149,5084351758860761,5569557656,2024-09-30 17:19:15,《舍不得星星》里的职场交锋真实精彩，清醒女主让人酣畅淋漓,来自广东,5084354156429545,0,0,《舍不得星星》里的职场交锋真实精彩，清醒女主让人酣畅淋漓,3953642330,李允霆,https://weibo.com/u/3953642330,,个子矮就不能喜欢李敏镐么～,江苏 扬州,f,75,1309,5952,84,2,27,113
150,5084351758860761,5569557656,2024-09-30 17:19:15,唐漾真是职场女性的典范，坚定不移地守护自己的立场和品味，令人钦佩,来自福建,5084354151974109,0,0,唐漾真是职场女性的典范，坚定不移地守护自己的立场和品味，令人钦佩,2553389935,爱莎贝拉,https://weibo.com/u/2553389935,,平谈的心情对待一切事物………,其他,f,224,1655,19495,,,,
151,5084351758860761,5569557656,2024-09-30 17:19:15,清醒的女主剧情让人耳目一新，职场交锋真实观察人性，角色的内心戏很吸引人,来自浙江,5084354152236717,0,0,清醒的女主剧情让人耳目一新，职场交锋真实观察人性，角色的内心戏很吸引人,5039734574,宏腾love,https://weibo.com/u/5039734574,,做不一样的自己,湖北 武汉,m,838,1932,10205,65,0,97,162
152,5084351758860761,5569557656,2024-09-30 17:19:15,看《舍不得星星》真是大开眼界，职场交锋精彩绝伦,来自浙江,5084354151450993,0,0,看《舍不得星星》真是大开眼界，职场交锋精彩绝伦,5644141099,今晚在家了,https://weibo.com/u/5644141099,,忙着呢,广东,m,938,2142,13092,157,133,218,508
153,5084351758860761,5569557656,2024-09-30 17:19:15,剧中职场交锋真实刺激，唐漾清醒大女主惹人喜欢,来自福建,5084354151711323,0,0,剧中职场交锋真实刺激，唐漾清醒大女主惹人喜欢,5707347194,小雷子曰,https://weibo.com/u/5707347194,,人不知而不愠,山西,m,445,1663,19902,,,,
154,5084351758860761,5569557656,2024-09-30 17:19:14,挺赞同的，唐漾的职场虎眼挺犀利的,来自广东,5084354145682376,0,0,挺赞同的，唐漾的职场虎眼挺犀利的,3751221991,梦绕千里,https://weibo.com/u/3751221991,,知足常乐的心态，稳稳幸福的生活！,浙江 湖州,f,125,973,8277,134,7,76,217
155,5084351758860761,5569557656,2024-09-30 17:19:14,唐漾果断拒绝盲目迎合，真有气质,来自广东,5084354145684143,0,0,唐漾果断拒绝盲目迎合，真有气质,1118899343,规定的兔子,https://weibo.com/u/1118899343,,,浙江 杭州,f,88,912,8095,151,32,21,204
156,5084351758860761,5569557656,2024-09-30 17:19:14,女主聪明又有原则，一定能处理好职场和个人关系,来自江苏,5084354148043937,0,0,女主聪明又有原则，一定能处理好职场和个人关系,3933769507,给寡人拿下,https://weibo.com/u/3933769507,,阳光，乐观，逗比,湖北 襄阳,m,752,1539,6818,38,5,38,81
157,5084351758860761,5569557656,2024-09-30 17:19:14,看到唐漾身手不凡，果然实力派女主让人敬佩,来自福建,5084354145684066,0,0,看到唐漾身手不凡，果然实力派女主让人敬佩,2657553010,采采狗尾草,https://weibo.com/u/2657553010,,喜欢林黛玉的才情，却不喜欢她的命运,广东,f,155,1555,15493,,,,
158,5084351758860761,5569557656,2024-09-30 17:19:14,唐漾遇到的职场挑战紧贴现实，引起了年轻观众的共鸣和关注,来自江西,5084354145684061,0,0,唐漾遇到的职场挑战紧贴现实，引起了年轻观众的共鸣和关注,1654685000,babyting__free,https://weibo.com/u/1654685000,,,上海 浦东新区,f,111,1511,9654,51,23,43,117
159,5084351758860761,5569557656,2024-09-30 17:19:13,唐漾实在太厉害了，职场女性的楷模,来自广东,5084354145419312,0,0,唐漾实在太厉害了，职场女性的楷模,2641763412,草青青ZHY,https://weibo.com/u/2641763412,,永远的怀念,北京,m,545,1377,14472,4,31,89,124
160,5084351758860761,5569557656,2024-09-30 17:19:13,《舍不得星星》点到为止的职场交锋很真实，喜欢女主的知性清醒,来自浙江,5084354141489396,0,0,《舍不得星星》点到为止的职场交锋很真实，喜欢女主的知性清醒,5407883045,Zhenhangsu,https://weibo.com/u/5407883045,,职业投资客,北京 朝阳区,m,904,2174,11625,,,,
161,5084351758860761,5569557656,2024-09-30 17:19:13,《舍不得星星》里职场交锋真实，靠谨慎和智慧,来自江西,5084354141487858,0,0,《舍不得星星》里职场交锋真实，靠谨慎和智慧,3243088014,Gqq477,https://weibo.com/u/3243088014,,,其他,m,911,1844,10303,,,,
162,5084351758860761,5569557656,2024-09-30 17:19:13,唐漾是真正的职场女王，聪明且清醒，不会轻易受人左右，超级喜欢她的性格！,来自江西,5084354143323099,0,0,唐漾是真正的职场女王，聪明且清醒，不会轻易受人左右，超级喜欢她的性格！,5631899859,陈大爷_21364,https://weibo.com/u/5631899859,,,云南 昆明,m,973,1912,8436,,,,
163,5084351758860761,5569557656,2024-09-30 17:19:13,这部剧的剧情确实很真实，职场上的人际关系交织复杂,来自江苏,5084354143062225,0,0,这部剧的剧情确实很真实，职场上的人际关系交织复杂,5645018859,Ohye爱杜,https://weibo.com/u/5645018859,,Yes，爱杜。,浙江,m,913,1521,9442,68,0,94,162
164,5084351758860761,5569557656,2024-09-30 17:19:13,职场斗智斗勇，女主张扬自我励志及格线强劲,来自广东,5084354142802362,0,0,职场斗智斗勇，女主张扬自我励志及格线强劲,5359651214,炫迈志,https://weibo.com/u/5359651214,,,湖南 长沙,m,252,747,4926,121,5,129,255
165,5084351758860761,5569557656,2024-09-30 17:19:13,《舍不得星星》职场交锋刻画淋漓，唐漾知世故,来自浙江,5084354141488031,0,0,《舍不得星星》职场交锋刻画淋漓，唐漾知世故,5157102135,吖甜小妞-,https://weibo.com/u/5157102135,,古龍說過，愛笑的女孩子，運氣不會太差。,广东,f,678,1971,8695,55,179,133,367
166,5084351758860761,5569557656,2024-09-30 17:19:13,职场斗争真实细腻，唐漾清醒果断,来自浙江,5084354142803596,0,0,职场斗争真实细腻，唐漾清醒果断,5371015868,小小心心大大梦,https://weibo.com/u/5371015868,,,其他,m,890,1989,7036,81,7,227,315
167,5084351758860761,5569557656,2024-09-30 17:19:13,终于有一个清醒又聪明的女主角，让人看得真是过瘾,来自福建,5084354142798907,0,0,终于有一个清醒又聪明的女主角，让人看得真是过瘾,2216771947,CeosonW,https://weibo.com/u/2216771947,,,上海 黄浦区,m,216,642,899,78,6,4,88
168,5084351758860761,5569557656,2024-09-30 17:19:13,这部剧让人心有戚戚焉，职场上充满了勾心斗角，女主的沉着和清醒给人不少启发,来自湖南,5084354143850286,0,0,这部剧让人心有戚戚焉，职场上充满了勾心斗角，女主的沉着和清醒给人不少启发,5442286176,北大燕园-,https://weibo.com/u/5442286176,,JILIDUEN,辽宁 朝阳,f,600,2263,7719,93,0,151,244
169,5084351758860761,5569557656,2024-09-30 17:19:13,职场中如此精明的女性令人刮目相看，这种知性清醒的态度是真正的职场女王范儿,来自江苏,5084354144110858,0,0,职场中如此精明的女性令人刮目相看，这种知性清醒的态度是真正的职场女王范儿,2320589375,传奇人生就是我1,https://weibo.com/u/2320589375,,,山东 威海,m,871,1661,8904,88,130,277,495
170,5084351758860761,5569557656,2024-09-30 17:19:13,《舍不得星星》里的职场女主如此清醒和犀利，真是让人感到钦佩和鼓舞啊,来自江西,5084354143323145,0,0,《舍不得星星》里的职场女主如此清醒和犀利，真是让人感到钦佩和鼓舞啊,2485340551,別說你認識我噢,https://weibo.com/u/2485340551,,2012.5.21,海外 英国,m,441,1389,15370,73,24,185,282
171,5084351758860761,5569557656,2024-09-30 17:19:12,"职场厮杀，玩心计，看得真过瘾 <a href=""//s.weibo.com/weibo?q=%23%E8%81%8C%E5%9C%BA%E9%A3%8E%E4%BA%91%23"" target=""_blank"">#职场风云#</a>",来自福建,5084354137294078,0,0,职场厮杀，玩心计，看得真过瘾 #职场风云#,2001475943,静静静missyou,https://weibo.com/u/2001475943,,心不在，寸寸烦恼，心在！步步莲花！莲花！,浙江 宁波,f,353,1329,9357,"1,442",155,103,"1,700"
172,5084351758860761,5569557656,2024-09-30 17:19:12,这部剧里的职场角逐确实描绘得淋漓尽致，角逐中的反击也相当精彩,来自浙江,5084354137035004,0,0,这部剧里的职场角逐确实描绘得淋漓尽致，角逐中的反击也相当精彩,5766911966,HUOL1ANG,https://weibo.com/u/5766911966,,临行一笔千秋生✍🏻,甘肃,m,837,1594,9282,105,9,181,295
173,5084351758860761,5569557656,2024-09-30 17:19:12,《舍不得星星》里的职场交锋真实又有力，唐漾的知性清醒让人印象深刻,来自广东,5084354139654649,0,0,《舍不得星星》里的职场交锋真实又有力，唐漾的知性清醒让人印象深刻,2062379545,海上花_SH,https://weibo.com/u/2062379545,,热爱生活！享受生活！,上海,f,258,662,1008,477,79,27,583
174,5084351758860761,5569557656,2024-09-30 17:19:11,曼妙无间，职场智慧,来自福建,5084354139390194,0,0,曼妙无间，职场智慧,1996637477,小叶子0710,https://weibo.com/u/1996637477,,想做一棵树的女人~,广东 广州,f,351,1308,11267,486,74,84,644
175,5084351758860761,5569557656,2024-09-30 17:19:12,这部剧里的职场斗争真是戳中了痛点，很解气啊！,来自福建,5084354139392492,0,0,这部剧里的职场斗争真是戳中了痛点，很解气啊！,3785873993,萝莉牛X王,https://weibo.com/u/3785873993,,做有价值的财经微博,广东 深圳,m,895,2099,13320,,,,
176,5084351758860761,5569557656,2024-09-30 17:19:12,这种职场剧很有代表性，年轻女性的职场斗争很现实，很喜欢这样的故事,来自广东,5084354139393001,0,0,这种职场剧很有代表性，年轻女性的职场斗争很现实，很喜欢这样的故事,1630160983,云飞扬9898,https://weibo.com/u/1630160983,,,其他,m,273,857,6375,130,4,48,182
177,5084351758860761,5569557656,2024-09-30 17:19:12,这部剧里职场交锋精彩纷呈，大女主游刃有余巧妙处理，棋高一着,来自广东,5084354138870246,0,0,这部剧里职场交锋精彩纷呈，大女主游刃有余巧妙处理，棋高一着,2490956027,杲杲1117,https://weibo.com/u/2490956027,,姐啥都没有就是衣服多…,广东 汕头,f,250,1596,13277,115,21,72,208
178,5084351758860761,5569557656,2024-09-30 17:19:12,即使年纪轻轻，也能用聪明和知识赢得职场的胜利,来自广东,5084354139130573,0,0,即使年纪轻轻，也能用聪明和知识赢得职场的胜利,2507623421,蜜师傅,https://weibo.com/u/2507623421,,,北京,m,339,1602,13141,,,,
179,5084351758860761,5569557656,2024-09-30 17:19:12,职场斗争的现实反映，聪明女主应对自如,来自福建,5084354138605260,0,0,职场斗争的现实反映，聪明女主应对自如,2693065824,妮妮好靓,https://weibo.com/u/2693065824,,,上海 宝山区,f,230,1320,13526,244,62,184,490
180,5084351758860761,5569557656,2024-09-30 17:19:12,唐漾的职场智慧，让人佩服,来自福建,5084354139130559,0,0,唐漾的职场智慧，让人佩服,3547112991,慢慢起飞的少年,https://weibo.com/u/3547112991,,,河北 邯郸,m,869,2016,13699,100,10,226,336
181,5084351758860761,5569557656,2024-09-30 17:19:12,职场交锋总是热血澎湃，看明白了才能玩转职场,来自福建,5084354138871999,0,0,职场交锋总是热血澎湃，看明白了才能玩转职场,2385915283,邓姣同学,https://weibo.com/u/2385915283,,一个活得简单，想得麻烦的人。,陕西,f,117,1322,11833,89,7,234,330
182,5084351758860761,5569557656,2024-09-30 17:19:12,《舍不得星星》职场交锋真实刺激大女主知世故而不世故，感觉十分带劲,来自广东,5084354139132341,0,0,《舍不得星星》职场交锋真实刺激大女主知世故而不世故，感觉十分带劲,1946247814,快乐的天使88888,https://weibo.com/u/1946247814,,,广东 东莞,m,372,939,7397,,,,
183,5084351758860761,5569557656,2024-09-30 17:19:12,看这部剧就像是观察职场现实，学到不少职场交际技巧,来自广东,5084354139130031,0,0,看这部剧就像是观察职场现实，学到不少职场交际技巧,3273810625,坤男人不狠万事难成,https://weibo.com/u/3273810625,,,其他,m,291,885,8094,,,,
184,5084351758860761,5569557656,2024-09-30 17:19:11,看了《舍不得星星》里的唐漾，果然大女主的独立清醒也很吸引人,来自福建,5084354139127982,0,0,看了《舍不得星星》里的唐漾，果然大女主的独立清醒也很吸引人,2000517457,郭景赞,https://weibo.com/u/2000517457,,,北京,m,768,1417,10446,,,,
185,5084351758860761,5569557656,2024-09-30 17:19:11,人精职场交锋，唐漾的清醒大女主可以驾驭,来自广东,5084354139652775,0,0,人精职场交锋，唐漾的清醒大女主可以驾驭,5806946699,李辰战0120,https://weibo.com/u/5806946699,,我觉得他好她就哪都好,北京 海淀区,m,400,993,7490,,,,
186,5084351758860761,5569557656,2024-09-30 17:19:11,"剧情反映了职场现实，清醒大女主角塑造成功<a href=""//s.weibo.com/weibo?q=%23%E7%A8%B3%E9%87%8D%E7%9F%A5%E6%80%A7%23"" target=""_blank"">#稳重知性#</a>",来自安徽,5084354138604704,0,0,剧情反映了职场现实，清醒大女主角塑造成功#稳重知性#,2487175441,云涯居士,https://weibo.com/u/2487175441,,路歸隱香處，翩然雪海間。,其他,m,411,1603,16043,,,,
187,5084351758860761,5569557656,2024-09-30 17:19:12,《舍不得星星》的职场交锋真实精彩，学长的计谋明显碰钉子了,来自广东,5084354139916446,0,0,《舍不得星星》的职场交锋真实精彩，学长的计谋明显碰钉子了,1862105855,那那小熊猫,https://weibo.com/u/1862105855,,人总是要长大的嘛👦,广东 东莞,m,975,1167,5211,52,0,3,55
188,5084351758860761,5569557656,2024-09-30 17:19:12,"演绎职场斗争，清醒大女主带来温暖力量 <a href=""//s.weibo.com/weibo?q=%23%E8%81%8C%E5%9C%BA%E5%89%A7%23"" target=""_blank"">#职场剧#</a>",来自广东,5084354138606749,0,0,演绎职场斗争，清醒大女主带来温暖力量 #职场剧#,2710516984,X杰I,https://weibo.com/u/2710516984,,,福建 南平,m,291,900,6418,124,5,234,363
189,5084351758860761,5569557656,2024-09-30 17:19:12,领袖魅力真是令人敬佩，深得直男心啊,来自广东,5084354139393391,0,0,领袖魅力真是令人敬佩，深得直男心啊,3927081303,1995乞丐,https://weibo.com/u/3927081303,,,广东 湛江,f,103,826,8116,107,4,305,416
190,5084351758860761,5569557656,2024-09-30 17:19:12,《舍不得星星》中职场交锋真实刺激，清醒女主角令人敬佩,来自广东,5084354139393640,0,0,《舍不得星星》中职场交锋真实刺激，清醒女主角令人敬佩,5893335804,胡庆儿儿儿,https://weibo.com/u/5893335804,,,安徽 六安,f,95,909,7521,126,6,111,243
191,5084351758860761,5569557656,2024-09-30 17:19:11,哪个男人不想有一个懂得职场交锋的女主做对象？,来自广东,5084354138604130,0,0,哪个男人不想有一个懂得职场交锋的女主做对象？,5349872975,干掉皇后就是妃子,https://weibo.com/u/5349872975,,没心没肺的孩子,广东 佛山,f,91,888,8062,129,15,180,324
192,5084351758860761,5569557656,2024-09-30 17:19:12,《舍不得星星》里的职场战斗让人看得热血沸腾，正能量满满的清醒女主很赞,来自广东,5084354137034060,0,0,《舍不得星星》里的职场战斗让人看得热血沸腾，正能量满满的清醒女主很赞,2594171511,暖夏木木木兰,https://weibo.com/u/2594171511,,梦想，为自己努力！,广西 南宁,f,132,1002,8337,124,72,293,489
193,5084351758860761,5569557656,2024-09-30 17:19:12,深度剖析职场斗争，揭露人际交往，让人目不暇接,来自江西,5084354139390533,0,0,深度剖析职场斗争，揭露人际交往，让人目不暇接,2605612794,她像是傻瓜,https://weibo.com/u/2605612794,,,其他,f,2107,1195,6429,,,,
194,5084351758860761,5569557656,2024-09-30 17:19:12,职场斗智斗勇，唐漾果然不好对付，把握机会，聪明应对，这样的女主角很有吸引力,来自浙江,5084354139656260,0,0,职场斗智斗勇，唐漾果然不好对付，把握机会，聪明应对，这样的女主角很有吸引力,5676056117,xl1314215,https://weibo.com/u/5676056117,,嘻嘻哈哈，快快乐乐,天津 静海区,f,597,1627,5557,49,70,188,307
195,5084351758860761,5569557656,2024-09-30 17:19:11,希望每位女性都能在职场上清醒大女主，不为情所动，能凭实力脱颖而出,来自浙江,5084354139128131,0,0,希望每位女性都能在职场上清醒大女主，不为情所动，能凭实力脱颖而出,3215230581,笑笑_她爸,https://weibo.com/u/3215230581,,,北京 朝阳区,m,1114,1783,8515,131,67,190,388
196,5084351758860761,5569557656,2024-09-30 17:19:12,职场中的聪明女人，知道如何站在自己的立场上不动摇。,来自江苏,5084354139130943,0,0,职场中的聪明女人，知道如何站在自己的立场上不动摇。,3163653941,BlackDay9409,https://weibo.com/u/3163653941,,I'm a fucking joke,其他,m,870,1741,8149,57,214,135,406
197,5084351758860761,5569557656,2024-09-30 17:19:12,老板的丛林法则果然是现实职场的真实写照，年轻女性要学会斗智斗勇才有机会立足,来自江西,5084354137036086,0,0,老板的丛林法则果然是现实职场的真实写照，年轻女性要学会斗智斗勇才有机会立足,5696820096,都市都市888,https://weibo.com/u/5696820096,,,北京,m,1101,2160,10299,94,632,228,954
198,5084351758860761,5569557656,2024-09-30 17:19:12,《舍不得星星》里职场斗争如此真实，让人眠增清醒,来自江西,5084354137295403,0,0,《舍不得星星》里职场斗争如此真实，让人眠增清醒,5207809180,糖糖精灵屋cute,https://weibo.com/u/5207809180,,,江苏 镇江,f,603,2084,9535,42,52,128,222
199,5084351758860761,5569557656,2024-09-30 17:19:12,职场中一言不合就要斗智斗勇，真是让人过足瘾,来自福建,5084354139917866,0,0,职场中一言不合就要斗智斗勇，真是让人过足瘾,5363740585,微辣酱爆兔,https://weibo.com/u/5363740585,,,其他,m,1024,1851,9978,,,,
200,5084351758860761,5569557656,2024-09-30 17:19:12,唐漾在职场里的处理方式非常清醒和成熟，不是被外部力量左右的类型，很不错,来自福建,5084354139916835,0,0,唐漾在职场里的处理方式非常清醒和成熟，不是被外部力量左右的类型，很不错,6023381791,冒纳凯阿,https://weibo.com/u/6023381791,,爱吃爱生活,广东 中山,f,678,2525,11235,101,139,36,276
201,5084351758860761,5569557656,2024-09-30 17:19:12,舍不得星星里的职场交锋真实霸气，年轻女主掌握实权清醒大气,来自广东,5084354139918621,0,0,舍不得星星里的职场交锋真实霸气，年轻女主掌握实权清醒大气,2025676983,Amit煽情,https://weibo.com/u/2025676983,,可怜兮兮。,四川 广安,f,192,1716,13237,130,5,40,175
202,5084351758860761,5569557656,2024-09-30 17:19:12,唐漾职场精英，不轻易受人左右,来自广东,5084354137034002,0,0,唐漾职场精英，不轻易受人左右,2036527391,Shino的新生活,https://weibo.com/u/2036527391,,,上海,f,514,2041,13631,"2,207",351,164,"2,722"
203,5084351758860761,5569557656,2024-09-30 17:19:12,《舍不得星星》里的职场交锋真实有力，看得让人体会到权力游戏的精彩,来自广东,5084354139128847,0,0,《舍不得星星》里的职场交锋真实有力，看得让人体会到权力游戏的精彩,5648067644,hey我是一只鱼,https://weibo.com/u/5648067644,,,山西 阳泉,f,51,990,7924,97,19,28,144
204,5084351758860761,5569557656,2024-09-30 17:19:12,《舍不得星星》角色变现实，职场交锋精彩,来自安徽,5084354138870286,0,0,《舍不得星星》角色变现实，职场交锋精彩,1971290653,妙白,https://weibo.com/u/1971290653,,现世安稳，岁月静好,河南,f,261,1821,15427,,,,
205,5084351758860761,5569557656,2024-09-30 17:19:12,这部剧对职场现实描绘得淋漓尽致，女主聪明冷静，让人佩服。,来自浙江,5084354137293835,0,0,这部剧对职场现实描绘得淋漓尽致，女主聪明冷静，让人佩服。,1876638345,JIE-HUAN,https://weibo.com/u/1876638345,,,其他,m,927,1945,11073,104,2,103,209
206,5084351758860761,5569557656,2024-09-30 17:19:12,我也超喜欢唐漾，她在职场里的聪明反应让人佩服，能学到不少职场心得呢,来自浙江,5084354139391238,0,0,我也超喜欢唐漾，她在职场里的聪明反应让人佩服，能学到不少职场心得呢,2698689835,L松松S,https://weibo.com/u/2698689835,,,其他,m,930,2062,11958,112,2,93,207
207,5084351758860761,5569557656,2024-09-30 17:19:12,唐漾职场斗争很精彩，赞,来自广东,5084354138605573,0,0,唐漾职场斗争很精彩，赞,2277048873,被格式化的少年,https://weibo.com/u/2277048873,,,浙江 杭州,m,532,969,9323,,,,
208,5084351758860761,5569557656,2024-09-30 17:19:11,唐漾的职场智慧让人敬佩，这种心机聪慧的女主真是让人耳目一新,来自安徽,5084354135461098,0,0,唐漾的职场智慧让人敬佩，这种心机聪慧的女主真是让人耳目一新,2508626861,啊飞520025,https://weibo.com/u/2508626861,,如果我累了，不爱了，放下了，那你再怎样都伤不了我，，你～不过是仗着我爱你,贵州,m,464,1476,17872,260,57,228,545
209,5084351758860761,5569557656,2024-09-30 17:19:11,唐漾的不张扬坚持，真是这部剧的一大亮点,来自江西,5084354134676953,0,0,唐漾的不张扬坚持，真是这部剧的一大亮点,2673762654,等候的服务区,https://weibo.com/u/2673762654,,心里有座粪 埋葬未亡人,重庆 九龙坡区,m,173,1173,11901,128,19,106,253
210,5084351758860761,5569557656,2024-09-30 17:19:11,职场交锋，挑战自我,来自福建,5084354134411219,0,0,职场交锋，挑战自我,2612271473,黎涡不浅笑,https://weibo.com/u/2612271473,,等到明年的冬天，你是否真的会回来？,其他,f,122,1566,18449,177,9,98,284
211,5084351758860761,5569557656,2024-09-30 17:19:11,年轻女性在职场上的交锋，亦是成长与蜕变,来自广东,5084354135462584,0,0,年轻女性在职场上的交锋，亦是成长与蜕变,5816770942,virgo-JingQueen,https://weibo.com/u/5816770942,,,广东 东莞,f,87,864,7337,88,1,32,121
212,5084351758860761,5569557656,2024-09-30 17:19:11,唐漾在职场里的聪明反思，给予年轻人的启发,来自福建,5084354132841886,0,0,唐漾在职场里的聪明反思，给予年轻人的启发,2230099371,琴琴MMer,https://weibo.com/u/2230099371,,,广东,f,166,1420,17455,129,17,212,358
213,5084351758860761,5569557656,2024-09-30 17:19:11,"唐漾在职场中不仅美丽，而且清醒敏锐 <a href=""//s.weibo.com/weibo?q=%23%E5%A5%B3%E6%80%A7%E8%81%8C%E5%9C%BA%E8%A7%92%E8%89%B2%23"" target=""_blank"">#女性职场角色#</a>",来自江西,5084354133101465,0,0,唐漾在职场中不仅美丽，而且清醒敏锐 #女性职场角色#,1907229141,老托尼stone,https://weibo.com/u/1907229141,,,天津 和平区,m,380,1354,10271,,,,
214,5084351758860761,5569557656,2024-09-30 17:19:11,剧中职场真实交锋令人大开眼界，唐漾清醒大女主形象深具吸引力,来自福建,5084354134416014,0,0,剧中职场真实交锋令人大开眼界，唐漾清醒大女主形象深具吸引力,1925258611,lhnxkw1988,https://weibo.com/u/1925258611,,母亲。,北京,f,141,1765,12119,,,,
215,5084351758860761,5569557656,2024-09-30 17:19:11,《舍不得星星》剧中职场交锋让人感到真实振奋，大女主的聪明和清醒让人佩服,来自福建,5084354132839552,0,0,《舍不得星星》剧中职场交锋让人感到真实振奋，大女主的聪明和清醒让人佩服,2519217977,Hx春风化雨,https://weibo.com/u/2519217977,,坚强的活着，释放完美的人生,福建,f,317,1588,18512,965,53,285,"1,303"
216,5084351758860761,5569557656,2024-09-30 17:19:11,看来聪明绝顶的唐漾是绝不会被轻易左右的，这样的大女主，让人敬佩,来自江西,5084354135198835,0,0,看来聪明绝顶的唐漾是绝不会被轻易左右的，这样的大女主，让人敬佩,2461428437,媚儿226,https://weibo.com/u/2461428437,, ,山东 青岛,f,96,1203,8806,98,43,42,183
217,5084351758860761,5569557656,2024-09-30 17:19:11,舍不得星星里的职场斗争真实又精彩，女主面对工作和人际关系处理得很好,来自江西,5084354134411113,0,0,舍不得星星里的职场斗争真实又精彩，女主面对工作和人际关系处理得很好,2391219843,卍顺其自然卍,https://weibo.com/u/2391219843,,平安是福，开心就好。,重庆 荣昌区,f,133,1573,17578,,,,
