,main_body_mid,main_body_uid,发布时间,处理内容,评论地点,mid,回复数量,点赞数量,原生内容,uid,用户昵称,用户主页,用户认证信息,用户描述,用户地理位置,用户性别,用户粉丝数量,用户关注数量,用户全部微博,用户累计评论,用户累计转发,用户累计获赞,用户转评赞
0,5154299685898595,6036380646,2025-04-11 17:54:14,所以其实我最赞同的就是婚产假男女同假,来自上海,5154303811521929,5,126,所以其实我最赞同的就是婚产假男女同假,5991787103,干酪同人抹猹少少调休HQ,https://weibo.com/u/5991787103,游戏博主,我是清都山水郎，天教分付与疏狂,上海,f,47822,2758,44487,"50,891","233,000","156,764","440,655"
1,5154299685898595,6036380646,2025-04-11 19:12:23,"正好发生在我身上 昨天下午收到了心仪公司的offer 今天上午拒绝了另一家公司的offer 结果中午就因为已婚未育被昨天那家公司拒了 <img alt=""[融化]"" title=""[融化]"" src=""https://face.t.sinajs.cn/t4/appstyle/expression/ext/normal/53/2022_melt_org.png"" /> 虽然结婚了但我是丁克 但没人相信 这个社会真的畸形",来自江苏,5154323478615261,10,34,正好发生在我身上 昨天下午收到了心仪公司的offer 今天上午拒绝了另一家公司的offer 结果中午就因为已婚未育被昨天那家公司拒了 [融化] 虽然结婚了但我是丁克 但没人相信 这个社会真的畸形,2140001850,山花的山,https://weibo.com/u/2140001850,,黄昏日落世界坠入光河,浙江 杭州,f,191,665,660,"1,086",1,"2,412","3,499"
2,5154299685898595,6036380646,2025-04-11 17:46:58,太正确了，栗子的观点和我一样，虽然我已婚已育，但是我非常支持不婚不育，也同样支持婚育，因为这是女性自己的选择，我们应该推进的是社会本身应该承担的责任，以及去掉一些腐朽的观点，争取实际意义上的女性权益。扩大自己的盟友而不是到处树敌。,来自北京,5154301983328830,0,50,太正确了，栗子的观点和我一样，虽然我已婚已育，但是我非常支持不婚不育，也同样支持婚育，因为这是女性自己的选择，我们应该推进的是社会本身应该承担的责任，以及去掉一些腐朽的观点，争取实际意义上的女性权益。扩大自己的盟友而不是到处树敌。,1620048034,猫小姐CLuB,https://weibo.com/u/1620048034,,等待回归，蓄力时间,其他,f,238,444,3609,"1,970",825,"2,084","4,879"
3,5154299685898595,6036380646,2025-04-11 20:01:04,国内婚育女性被针对，还有一点是因为本身就饱和的工作，因为少了一个劳动力，分担到其他人身上，工作就更饱和了。而一些国家是会专门给正在休婚育假的岗位，再招聘一个人顶这段时间。,来自重庆,5154335730700407,0,14,国内婚育女性被针对，还有一点是因为本身就饱和的工作，因为少了一个劳动力，分担到其他人身上，工作就更饱和了。而一些国家是会专门给正在休婚育假的岗位，再招聘一个人顶这段时间。,6315991136,啵啵欢狗,https://weibo.com/u/6315991136,,美人的心不能伤,其他,f,73,89,1801,260,75,542,877
4,5154299685898595,6036380646,2025-04-11 21:22:33,"我们口口声声反对压迫，结果却在无形中也参与了压迫。<img alt=""[并不简单]"" title=""[并不简单]"" src=""https://face.t.sinajs.cn/t4/appstyle/expression/ext/normal/aa/2018new_bingbujiandan_org.png"" />",来自安徽,5154356236387861,0,4,我们口口声声反对压迫，结果却在无形中也参与了压迫。[并不简单],1247095412,Smile微笑的彼得潘,https://weibo.com/u/1247095412,,幼稚起来可以去读幼儿园，深沉起来可以媲美哲学家。心软敏感易感动，可疯狂可安静。喜欢就没什么不可以！,江苏 南京,f,639,667,10079,"3,566","1,146",404,"5,116"
5,5154299685898595,6036380646,2025-04-11 18:41:13,女性无论作何种选择都是应有的权利 不同的选择不应成为互相敌对的理由,来自山东,5154315636053260,0,3,女性无论作何种选择都是应有的权利 不同的选择不应成为互相敌对的理由,2702881441,Lynnlynnni,https://weibo.com/u/2702881441,,,香港 其他,f,109,440,65,202,0,198,400
6,5154299685898595,6036380646,2025-04-11 21:04:18,栗子你好 可以麻烦回我下私信吗 呼和浩特卓凡学校的老师一直没取件,来自安徽,5154351644416126,1,0,栗子你好 可以麻烦回我下私信吗 呼和浩特卓凡学校的老师一直没取件,3652711120,q1iiiiii,https://weibo.com/u/3652711120,,略,海外,f,359,155,2197,"2,982","61,136","2,757","66,875"
7,5154299685898595,6036380646,2025-04-11 20:06:25,现在工作真的特别难找…..哎，工作特别低,来自陕西,5154337081787078,2,4,现在工作真的特别难找…..哎，工作特别低,5152879348,潮鳴ll,https://weibo.com/u/5152879348,,,湖南,f,93,114,3708,"2,162",145,"3,720","6,027"
8,5154299685898595,6036380646,2025-04-11 18:21:49,我也是，我也不会敌视婚育女性。每个人都有自己的选择。,来自广西,5154310758072585,0,2,我也是，我也不会敌视婚育女性。每个人都有自己的选择。,6390953806,过好当下一切都好,https://weibo.com/u/6390953806,,😌🉑🙈🤟💓🦐💕🉐👑➕😋🈶🔥🇨🇳🚿💪🏻💰🤣🍗👌🏻🍰🥳☺️很好,湖南,f,654,2386,77094,425,"4,913","2,861","8,199"
9,5154299685898595,6036380646,2025-04-11 17:54:46,底层互害真的是惯用伎俩了,来自河南,5154303949930660,1,10,底层互害真的是惯用伎俩了,2315320985,小羊尾巴没有了,https://weibo.com/u/2315320985,,读博中（读的微博,其他,f,169,122,435,"1,082",21,441,"1,544"
10,5154299685898595,6036380646,2025-04-11 21:11:37,"<img alt=""[苦涩]"" title=""[苦涩]"" src=""https://face.t.sinajs.cn/t4/appstyle/expression/ext/normal/7e/2021_bitter_org.png"" />豁然开朗",来自江苏,5154353489641630,0,0,[苦涩]豁然开朗,5944116068,晚上少吃点啊,https://weibo.com/u/5944116068,,真诚 善良 勇敢,其他,f,55,586,796,308,47,342,697
11,5154299685898595,6036380646,2025-04-11 18:05:02,婚姻制度就是结构性压迫里的“结构”之一，希望女性能不进入结构，不被其压迫，不加固其结构。,来自河北,5154306534146521,0,9,婚姻制度就是结构性压迫里的“结构”之一，希望女性能不进入结构，不被其压迫，不加固其结构。,7279600675,JSXW-DBGRC,https://weibo.com/u/7279600675,,镇魂/abo/🌈/新建文件夹/les/lgbt/gay（大眼有🧊💢）,其他,f,29,143,499,0,113,161,274
12,5154299685898595,6036380646,2025-04-11 18:05:18,栗子的表达能力好强！！！,来自广东,5154306597328009,0,3,栗子的表达能力好强！！！,2436565842,小邵的好好生活日记,https://weibo.com/u/2436565842,,人生关键词：勇敢 专注 耐心 坚毅 热爱🫶,江西 南昌,f,2,21,99,9,1,10,20
13,5154299685898595,6036380646,2025-04-13 19:20:13,是啊是啊这个社会总是要女性付出又轻视女性,来自河南,5155050226456163,0,1,是啊是啊这个社会总是要女性付出又轻视女性,6531356732,史迪仔有酒窝,https://weibo.com/u/6531356732,,这个世界乱糟糟的，而你干干净净，可以悬在我的心上，作太阳和月亮,其他,f,52,176,521,970,7,672,"1,649"
14,5154299685898595,6036380646,2025-04-12 00:02:11,"女生找工作真的太难了，从毕业开始找工作的时候就会问到有没有男朋友，到现在问婚育打算<img alt=""[努力]"" title=""[努力]"" src=""https://face.t.sinajs.cn/t4/appstyle/expression/ext/normal/7c/2022_Keepgoing_org.png"" />，无话可说了",来自浙江,5154396409956969,0,1,女生找工作真的太难了，从毕业开始找工作的时候就会问到有没有男朋友，到现在问婚育打算[努力]，无话可说了,5656540632,焦糖布丁哎,https://weibo.com/u/5656540632,,好好生活,湖北 武汉,f,84,169,314,251,5,476,732
15,5154299685898595,6036380646,2025-04-12 08:49:40,太支持了,来自广西,5154529154961306,0,0,太支持了,6679020814,four-seven47,https://weibo.com/u/6679020814,,,其他,f,18,190,1325,559,11,837,"1,407"
16,5154299685898595,6036380646,2025-04-11 19:53:32,"之前25岁面试的时候 就被问有没有结婚 有没有男朋友 但是男的就不会被问这些问题<img alt=""[允悲]"" title=""[允悲]"" src=""https://face.t.sinajs.cn/t4/appstyle/expression/ext/normal/83/2018new_kuxiao_org.png"" />",来自江苏,5154333834348280,0,0,之前25岁面试的时候 就被问有没有结婚 有没有男朋友 但是男的就不会被问这些问题[允悲],6900520886,心如槁木,https://weibo.com/u/6900520886,,没有栖息地的蝴蝶 我又如何能约束,其他,f,132,451,464,434,16,623,"1,073"
17,5154299685898595,6036380646,2025-04-13 18:28:09,我现在未婚，我是不婚以及丁克主义，鲜少有遇到异性能接受我这点。但是没关系，我内心崇尚自由，我认为一但结婚或者生育就会把我拉入泥沼。,来自四川,5155037124494336,0,0,我现在未婚，我是不婚以及丁克主义，鲜少有遇到异性能接受我这点。但是没关系，我内心崇尚自由，我认为一但结婚或者生育就会把我拉入泥沼。,5687723718,我在嘉禾望岗,https://weibo.com/u/5687723718,,你是我所有的青春岁月，是我所有不能忘的欢笑与哀愁!,海南,f,408,262,1066,344,50,"1,232","1,626"
18,5154299685898595,6036380646,2025-04-13 14:38:23,"其实解决问题的答案很简单 然而即使科技的快速发展也没能满足人类的各类欲望<img alt=""[doge]"" title=""[doge]"" src=""https://face.t.sinajs.cn/t4/appstyle/expression/ext/normal/a1/2018new_doge02_org.png"" /><img alt=""[doge]"" title=""[doge]"" src=""https://face.t.sinajs.cn/t4/appstyle/expression/ext/normal/a1/2018new_doge02_org.png"" /><img alt=""[doge]"" title=""[doge]"" src=""https://face.t.sinajs.cn/t4/appstyle/expression/ext/normal/a1/2018new_doge02_org.png"" />",来自浙江,5154979301296585,0,0,其实解决问题的答案很简单 然而即使科技的快速发展也没能满足人类的各类欲望[doge][doge][doge],1616965850,Mong萌呀,https://weibo.com/u/1616965850,,最喜雨停后 最爱雾起时,浙江 宁波,f,135,487,1281,"1,850",251,"1,219","3,320"
19,5154299685898595,6036380646,2025-04-13 07:40:02,你终于成长了，曾经因为你的激进我不太认同差点想取关你,来自广西,5154874019807989,0,0,你终于成长了，曾经因为你的激进我不太认同差点想取关你,1912875763,MistySln,https://weibo.com/u/1912875763,,美女荷官在线发脾气,广西 南宁,f,1218,240,385,744,7,640,"1,391"
20,5154299685898595,6036380646,2025-04-12 20:55:29,好希望有结婚冷静期和男女婚产假同假。,来自德国,5154711812968619,0,0,好希望有结婚冷静期和男女婚产假同假。,6709597017,M钱钱钱钱钱钱钱钱,https://weibo.com/u/6709597017,超话主持人（南昌宠物超话）,钱从四面八方来来来，进我口袋。,广东,f,260,1548,2903,"3,665",66,"5,583","9,314"
21,5154299685898595,6036380646,2025-04-12 15:51:53,怎么男的就不会面临职场上的婚育问题 孩子又不只是妈妈的责任,来自广东,5154635410834529,0,0,怎么男的就不会面临职场上的婚育问题 孩子又不只是妈妈的责任,3219876444,容易烫嘴的汤包,https://weibo.com/u/3219876444,,不给自己设限,广东,f,246,100,403,680,1,499,"1,180"
22,5154299685898595,6036380646,2025-04-12 13:21:57,"<img alt=""[好运连连]"" title=""[好运连连]"" src=""https://face.t.sinajs.cn/t4/appstyle/expression/ext/normal/ec/2024_Goodluck_org.png"" /><img alt=""[好运连连]"" title=""[好运连连]"" src=""https://face.t.sinajs.cn/t4/appstyle/expression/ext/normal/ec/2024_Goodluck_org.png"" />",来自广东,5154597677826790,0,0,[好运连连][好运连连],5650653564,爱吃小草莓的大笨熊,https://weibo.com/u/5650653564,,永远相信美好的事情即将发生,四川,f,123,254,1498,"1,330",28,992,"2,350"
23,5154299685898595,6036380646,2025-04-12 08:52:59,说得好,来自河南,5154529995129225,0,0,说得好,1993768532,别来沾边拴Q,https://weibo.com/u/1993768532,,(๑ت๑)ﾉ简简单单💜♪ 新建文件夹,海外 泰国,f,24,297,893,459,1,122,582
24,5154299685898595,6036380646,2025-04-12 08:48:08,确实,来自安徽,5154528774062220,0,0,确实,6087279071,起名废emmm,https://weibo.com/u/6087279071,,,安徽,f,111,387,3557,186,1,55,242
25,5154299685898595,6036380646,2025-04-12 00:06:18,这班我上不了一点了,来自重庆,5154397446211098,0,0,这班我上不了一点了,5731139761,pallsc,https://weibo.com/u/5731139761,,结果都一样,重庆,f,31,11,93,4,41,1,46
26,5154299685898595,6036380646,2025-04-11 22:47:59,我们都曾有偏颇的时候，包括现在也难以避免，但是，我们在成长，逐渐变得包容和豁达。你会影响你身边的人和看你微博的人（比如我），这些姐妹会成长，然后去影响她们身边的人，大家逐渐清醒，逐渐强大，也足够包容……过程也许很缓慢，但是先往前走着吧。,来自贵州,5154377736918192,0,0,我们都曾有偏颇的时候，包括现在也难以避免，但是，我们在成长，逐渐变得包容和豁达。你会影响你身边的人和看你微博的人（比如我），这些姐妹会成长，然后去影响她们身边的人，大家逐渐清醒，逐渐强大，也足够包容……过程也许很缓慢，但是先往前走着吧。,1593786594,溪生溪悦,https://weibo.com/u/1593786594,,复杂到一言难尽，简单到一目了然。,贵州 贵阳,f,193,287,572,"1,389",120,97,"1,606"
27,5154299685898595,6036380646,2025-04-11 22:20:22,说到底就是职场歧视女性，所以生育率下降都是应该的。,来自浙江,5154370786955216,0,0,说到底就是职场歧视女性，所以生育率下降都是应该的。,5948605156,豌豆花花大仙人掌,https://weibo.com/u/5948605156,,要开心哦💓,浙江 温州,f,198,492,19677,"1,457",154,"2,124","3,735"
28,5154299685898595,6036380646,2025-04-11 22:01:06,"30未婚未育也会被拒绝<img alt=""[泪]"" title=""[泪]"" src=""https://face.t.sinajs.cn/t4/appstyle/expression/ext/normal/6e/2018new_leimu_org.png"" />",来自湖北,5154365939124114,0,1,30未婚未育也会被拒绝[泪],5679468346,ZLSDxka,https://weibo.com/u/5679468346,,,其他,f,39,602,800,0,0,32,32
29,5154299685898595,6036380646,2025-04-11 20:47:56,太难了，面试填表婚育那栏被要求填，面试后就没下文了，还有的直接劝我回家生孩子,来自重庆,5154347525081701,0,0,太难了，面试填表婚育那栏被要求填，面试后就没下文了，还有的直接劝我回家生孩子,6033035907,回忆里的光block,https://weibo.com/u/6033035907,,好运常在！,重庆,f,2112,2436,730,"2,088",3,"2,856","4,947"
30,5154299685898595,6036380646,2025-04-11 18:33:03,真的好喜欢栗子 说的好棒,来自贵州,5154313581364175,0,0,真的好喜欢栗子 说的好棒,7417781112,从不吃大饼1,https://weibo.com/u/7417781112,,心软之人多是无福之人,贵州,m,238,552,363,7,3,51,61
31,5154299685898595,6036380646,2025-04-11 18:14:53,"说得太好了<img alt=""[good]"" title=""[good]"" src=""https://face.t.sinajs.cn/t4/appstyle/expression/ext/normal/8a/2018new_good_org.png"" />",来自广东,5154309009312779,0,0,说得太好了[good],2164711620,亲爱的水果糖,https://weibo.com/u/2164711620,,,广东 广州,f,153,397,2524,125,54,156,335
32,5154299685898595,6036380646,2025-04-13 10:52:50,"甚至不止普通公司这样做，认识的人在学术圈，有老师推荐她进研究院，都要求她五年内不能生育，否则以后这个老师推荐的所有人都不再收<img alt=""[怒]"" title=""[怒]"" src=""https://face.t.sinajs.cn/t4/appstyle/expression/ext/normal/f6/2018new_nu_org.png"" />最后去了私企",来自河南,5154922540304970,0,0,甚至不止普通公司这样做，认识的人在学术圈，有老师推荐她进研究院，都要求她五年内不能生育，否则以后这个老师推荐的所有人都不再收[怒]最后去了私企,3907911311,神羊山,https://weibo.com/u/3907911311,,禁止期待,其他,f,134,164,2743,"1,425",27,711,"2,163"
33,5154299685898595,6036380646,2025-04-12 09:57:24,"女性不应该存在<img alt=""[doge]"" title=""[doge]"" src=""https://face.t.sinajs.cn/t4/appstyle/expression/ext/normal/a1/2018new_doge02_org.png"" />这个社会应该布满男宝<img alt=""[doge]"" title=""[doge]"" src=""https://face.t.sinajs.cn/t4/appstyle/expression/ext/normal/a1/2018new_doge02_org.png"" />",来自广东,5154546201923317,0,0,女性不应该存在[doge]这个社会应该布满男宝[doge],7953183196,用户7953183196,https://weibo.com/u/7953183196,,,其他,m,129,74,39,0,6,2,8
34,5154299685898595,6036380646,2025-04-12 12:47:29,在小红书上你会看到很多自称是是HR 和同事的人，讨伐入职后生育的女性，”我女我也觉得这样损害公司，其他女人的利益”,来自浙江,5154589003225370,0,0,在小红书上你会看到很多自称是是HR 和同事的人，讨伐入职后生育的女性，”我女我也觉得这样损害公司，其他女人的利益”,1931680724,小yum人,https://weibo.com/u/1931680724,,大部分时间处于低功耗模式,辽宁,f,201,661,2586,966,102,663,"1,731"
35,5154299685898595,6036380646,2025-04-12 06:44:50,我是一名山区教师，我们这里很多留守儿童，贫困孩子，希望有爱心人士帮助他们,来自广东,5154497740933002,0,0,我是一名山区教师，我们这里很多留守儿童，贫困孩子，希望有爱心人士帮助他们,5689141323,789蓝莓,https://weibo.com/u/5689141323,,,广东 韶关,f,6,49,10,0,0,2,2
36,5154299685898595,6036380646,2025-04-11 21:44:32,害 监狱里百分之90多都是男的 也没把男的路堵死呀,来自山西,5154361769198603,0,4,害 监狱里百分之90多都是男的 也没把男的路堵死呀,5268148376,卫生巾应该免费,https://weibo.com/u/5268148376,,自来卷 小绵羊,山西 晋中,f,188,716,313,148,15,114,277
