,main_body_mid,main_body_uid,发布时间,处理内容,评论地点,mid,回复数量,点赞数量,原生内容,uid,用户昵称,用户主页,用户描述,用户地理位置,用户性别,用户粉丝数量,用户关注数量,用户全部微博,用户累计评论,用户累计转发,用户累计获赞,用户转评赞
0,5102048707875298,6239886878,2024-11-18 13:42:17,"这点特别好,谢谢老辣的点评<img alt=""[打call]"" title=""[打call]"" src=""https://face.t.sinajs.cn/t4/appstyle/expression/ext/normal/39/moren_dacall02_org.png"" />后面75岁的女主为Alex辩护,说自己的年代对x骚扰人们普遍都是戏谑的态度,会跟她说为赢去跟对方律师上床<img alt=""[吐]"" title=""[吐]"" src=""https://face.t.sinajs.cn/t4/appstyle/expression/ext/normal/08/2018new_tu_org.png"" />直到她被上司?骚扰,为避开放弃自己追求的方向,彻底颠覆了梦想…而Alex得是感觉多糟糕、付出多大勇气,才会当被公开审判羞辱的“吹哨人”,虽然错的是骚扰惯犯",来自北京,5102056555153004,5,61,"这点特别好,谢谢老辣的点评[打call]后面75岁的女主为Alex辩护,说自己的年代对x骚扰人们普遍都是戏谑的态度,会跟她说为赢去跟对方律师上床[吐]直到她被上司?骚扰,为避开放弃自己追求的方向,彻底颠覆了梦想…而Alex得是感觉多糟糕、付出多大勇气,才会当被公开审判羞辱的“吹哨人”,虽然错的是骚扰惯犯",6593562467,RadioFlyerHigher7120,https://weibo.com/u/6593562467,No Sexual Harassment.No Smoking,其他,f,46,379,22594,923,"1,512","1,808","4,243"
1,5102048707875298,6239886878,2024-11-19 16:56:19,"奥林匹娅说接这个案子最大的原因是因为她女儿，因为这个案子很复杂，如果这场赢了，她女儿就会有复杂的权利，那一下真的觉得这一集瞬间在我心里拔高了，没有什么不完美的受害者只有受害者<img alt=""[老师好]"" title=""[老师好]"" src=""https://face.t.sinajs.cn/t4/appstyle/expression/ext/normal/0d/2022_Teacher_org.png"" />",来自河南,5102467773893896,0,39,奥林匹娅说接这个案子最大的原因是因为她女儿，因为这个案子很复杂，如果这场赢了，她女儿就会有复杂的权利，那一下真的觉得这一集瞬间在我心里拔高了，没有什么不完美的受害者只有受害者[老师好],5891842210,Phoebe灬,https://weibo.com/u/5891842210,🌙One should always maintain a little absurdity,河南 郑州,f,123,96,103,390,176,"4,324","4,890"
2,5102048707875298,6239886878,2024-11-18 13:46:03,犯罪就是犯罪。性骚扰基本都是故意的。,来自瑞士,5102057501495009,0,34,犯罪就是犯罪。性骚扰基本都是故意的。,5869740502,LoveeeAgain,https://weibo.com/u/5869740502,That’s when I get my motion!❄️❄️,海外 美国,f,10,149,189,21,47,15,83
3,5102048707875298,6239886878,2025-02-13 11:46:49,"其实就是把人当人，别管男女，别管职业就算人家是风俗行业从业人员，该有的对人类的最基本的尊重也得有。但问题的悖论就在于，那些常常搞性骚扰、猥亵、热衷不分场合在女性面前讲荤段子、花钱去买sex服务的这类人群他们很多时候追求的不单是生理体验，还有掩藏起来的“我在支配他人的过程中”获得爽感。 ...<span class=""expand"">全文</span>",来自四川,5133555242109990,0,12,其实就是把人当人，别管男女，别管职业就算人家是风俗行业从业人员，该有的对人类的最基本的尊重也得有。但问题的悖论就在于，那些常常搞性骚扰、猥亵、热衷不分场合在女性面前讲荤段子、花钱去买sex服务的这类人群他们很多时候追求的不单是生理体验，还有掩藏起来的“我在支配他人的过程中”获得爽感。,6216201694,就叫ZNZ,https://weibo.com/u/6216201694,,其他,m,94,680,6810,125,71,215,411
4,5102048707875298,6239886878,2025-02-13 12:06:15,望周知,来自广东,5133560131883119,0,0,望周知,2117388464,甜籽吐司,https://weibo.com/u/2117388464,Love is in the actions.,广东,f,423,284,1083,448,54,329,831
5,5102048707875298,6239886878,2024-11-20 09:16:36,"<a href=/n/坚果大天真 usercard=""name=@坚果大天真"">@坚果大天真</a>",来自浙江,5102714467911876,0,0,@坚果大天真,5642630352,高兴九号,https://weibo.com/u/5642630352,你可,浙江,f,525,755,5225,"2,667",52,"2,745","5,464"
6,5102048707875298,6239886878,2024-11-18 17:56:57,转发微博,来自广西,5102120642808067,0,0,转发微博,5998079332,Souvenir猫儿,https://weibo.com/u/5998079332,祉猷并茂，顺遂无虞。,其他,f,82,164,95168,"8,953","28,719","23,824","61,496"
