,main_body_mid,main_body_uid,发布时间,处理内容,评论地点,mid,回复数量,点赞数量,原生内容,uid,用户昵称,用户主页,用户描述,用户地理位置,用户性别,用户粉丝数量,用户关注数量,用户全部微博,用户累计评论,用户累计转发,用户累计获赞,用户转评赞
42,5067938132662320,6626867192,2024-08-20 02:17:09,看到同龄人就随便讲讲，独立不是买房这么简单，你的经济独立已经实现了，但是精神独立还有很长的路要走，所以你才感受不到快乐，三言两语讲不清，慢慢悟吧。,来自四川,5069269227798758,0,0,看到同龄人就随便讲讲，独立不是买房这么简单，你的经济独立已经实现了，但是精神独立还有很长的路要走，所以你才感受不到快乐，三言两语讲不清，慢慢悟吧。,6071907986,软萌源酱的真面目是金刚芭比,https://weibo.com/u/6071907986,一闪一闪亮晶晶✨ 圆圆眼里藏星星✨1：记得初心，独立思考 2：solo追星（别的一样）不混任何圈子，莫挨老子！【非必要不评论】❗放简介里提醒自己,其他,f,9,292,739,436,55,364,855
43,5067938132662320,6626867192,2024-08-16 10:33:53,"太闲了建议工作给我…以及这个工资你出来租房住都很舒服<img alt=""[允悲]"" title=""[允悲]"" src=""https://face.t.sinajs.cn/t4/appstyle/expression/ext/normal/83/2018new_kuxiao_org.png"" />",来自江苏,5067944684161507,0,10,太闲了建议工作给我…以及这个工资你出来租房住都很舒服[允悲],6465473261,Algernon_等待玫瑰的charlie,https://weibo.com/u/6465473261,"""What do you think you are？Are you an evil spirit？""  ""Yes. And one of yours I hope.""",其他,f,455,298,10978,"13,025","11,033","22,034","46,092"
44,5067938132662320,6626867192,2024-08-16 10:13:52,手里有的太多了，没办法扔开已有的去破釜沉舟，舒适度70%的得过且过,来自浙江,5067939650470501,0,3,手里有的太多了，没办法扔开已有的去破釜沉舟，舒适度70%的得过且过,6683042725,小鸟布鲁,https://weibo.com/u/6683042725,我说我是疯的！为什么不相信我！ 镇魂,其他,f,606,482,5414,"5,611","4,599","4,848","15,058"
45,5067938132662320,6626867192,2024-08-16 12:41:41,"不做给我做，羡慕死了<img alt=""[苦涩]"" title=""[苦涩]"" src=""https://face.t.sinajs.cn/t4/appstyle/expression/ext/normal/7e/2021_bitter_org.png"" /><img alt=""[苦涩]"" title=""[苦涩]"" src=""https://face.t.sinajs.cn/t4/appstyle/expression/ext/normal/7e/2021_bitter_org.png"" />",来自湖北,5067976846089932,0,0,不做给我做，羡慕死了[苦涩][苦涩],7316455383,Canace_Holmes,https://weibo.com/u/7316455383,白起/夏彦/路辰/沈星回，时不时爬墙凌肖/小陆总/爹咪/秦彻。所有男人都爱的海王,其他,f,72,222,1105,548,16,681,"1,245"
46,5067938132662320,6626867192,2024-08-16 11:17:12,我懂，有人上进了一辈子，突然没有上升的途径和希望了，就会蒙逼。也不是甘于躺平的人,来自江苏,5067955585158053,0,0,我懂，有人上进了一辈子，突然没有上升的途径和希望了，就会蒙逼。也不是甘于躺平的人,5180028065,真是为难了我小杰瑞,https://weibo.com/u/5180028065,有思想的青年，也有一位男神,江苏 南京,f,157,209,2512,154,58,512,724
47,5067938132662320,6626867192,2024-08-16 10:28:52,"蹲一个下班娱乐和副业<img alt=""[允悲]"" title=""[允悲]"" src=""https://face.t.sinajs.cn/t4/appstyle/expression/ext/normal/83/2018new_kuxiao_org.png"" />",来自河南,5067943419585119,0,0,蹲一个下班娱乐和副业[允悲],5715724999,是momo酱吗,https://weibo.com/u/5715724999,健康的生活👏,河南 洛阳,f,117,138,856,550,74,407,"1,031"
48,5067938132662320,6626867192,2024-08-16 11:34:20,稿主我和你很像可是私信我聊聊~我也是本硕毕业回老家稳定工作+住家里，朋友不算太多，工作不是特别繁忙刚刚工龄两年。主要还是找点事做、或者红薯找找细分领域的搭子，我前年下班打炉石，去年喜欢一边听小说一边数字油画，今年被闺蜜拉着开始健身。。。,来自山东,5067959896638893,4,4,稿主我和你很像可是私信我聊聊~我也是本硕毕业回老家稳定工作+住家里，朋友不算太多，工作不是特别繁忙刚刚工龄两年。主要还是找点事做、或者红薯找找细分领域的搭子，我前年下班打炉石，去年喜欢一边听小说一边数字油画，今年被闺蜜拉着开始健身。。。,5123415005,望舒为月Vcn__许嵩见过5次版,https://weibo.com/u/5123415005,故人题词十年前🍂   镇魂/ABO/百合,海外,f,352,398,3007,"8,872",283,"10,493","19,648"
49,5067938132662320,6626867192,2024-08-16 10:10:16,就是过的太舒服了....出来吃点苦就知道现在多安逸了,来自浙江,5067938741357769,0,49,就是过的太舒服了....出来吃点苦就知道现在多安逸了,7224682546,整点薯条er77,https://weibo.com/u/7224682546,诸事皆顺版,其他,f,7,249,302,928,63,"1,181","2,172"
