,main_body_mid,main_body_uid,发布时间,处理内容,评论地点,mid,回复数量,点赞数量,原生内容,uid,用户昵称,用户主页,用户描述,用户地理位置,用户性别,用户粉丝数量,用户关注数量,用户全部微博,用户累计评论,用户累计转发,用户累计获赞,用户转评赞,用户认证信息
0,5147388039138259,5365769881,2025-03-23 15:57:12,不是  女拳搞的吗  应聘的时候啥苦都能吃，进去了以后写小作文,来自内蒙古,5147388991246548,45,402,不是  女拳搞的吗  应聘的时候啥苦都能吃，进去了以后写小作文,1988161063,安条克的瓦伦娜,https://weibo.com/u/1988161063,,其他,m,73,187,348,23,13,15,51,
1,5147388039138259,5365769881,2025-03-23 16:14:07,"如果一个性别频繁使用性别来索取更多的东西，你问出钱的怕不怕。当越来越多人，一过试用期就怀孕，休假，哺乳期后就辞职，而现在连问一下婚育情况都不允许，那些出钱的不怕?利用法律把别人榨到极致，转头说别人歧视<img alt=""[doge]"" title=""[doge]"" src=""https://face.t.sinajs.cn/t4/appstyle/expression/ext/normal/a1/2018new_doge02_org.png"" />。我女的都看不过眼。",来自广东,5147393247677339,29,116,如果一个性别频繁使用性别来索取更多的东西，你问出钱的怕不怕。当越来越多人，一过试用期就怀孕，休假，哺乳期后就辞职，而现在连问一下婚育情况都不允许，那些出钱的不怕?利用法律把别人榨到极致，转头说别人歧视[doge]。我女的都看不过眼。,5479726407,1随便改个名1,https://weibo.com/u/5479726407,,广东 江门,f,21,398,1074,31,120,228,379,
2,5147388039138259,5365769881,2025-03-23 16:20:50,女生都去上班，谁生孩子？两性本质不同，分工不同，不能等同视之。尊重性别天然属性分工，这不是歧视。,来自吉林,5147394938505300,23,23,女生都去上班，谁生孩子？两性本质不同，分工不同，不能等同视之。尊重性别天然属性分工，这不是歧视。,7819754552,用户7819754552,https://weibo.com/u/7819754552,,其他,f,71,404,33,22,4,25,51,
3,5147388039138259,5365769881,2025-03-23 16:51:01,"女的当男的用，男的当骡子用，这是屁话。恰恰女的失业在家专司相夫教子，他们才能把男的当骡子用。家里好几张嘴都指着男的那点工资，再背上房贷车贷，男的就戴上镣铐了。他敢轻易换工作吗？敢请假吗？敢生病吗？敢跟老板提条件吗？老板说他是牛马他就是牛马？说他是骡子他就是骡子。其实双职工家庭才是 ...<span class=""expand"">全文</span>",来自江苏,5147402534390671,27,24,女的当男的用，男的当骡子用，这是屁话。恰恰女的失业在家专司相夫教子，他们才能把男的当骡子用。家里好几张嘴都指着男的那点工资，再背上房贷车贷，男的就戴上镣铐了。他敢轻易换工作吗？敢请假吗？敢生病吗？敢跟老板提条件吗？老板说他是牛马他就是牛马？说他是骡子他就是骡子。其实双职工家庭才是,5419771366,秦小官人,https://weibo.com/u/5419771366,~,浙江,m,2705,47,5318,"6,691","38,403","17,686","62,780",超话主持人（科学女权主义超话） 头条文章作者
4,5147388039138259,5365769881,2025-03-23 16:15:36,女的经济独立越艰难，越需要投靠家庭找到安全感，反而更有利于生育率的提升。,来自四川,5147393621495216,25,45,女的经济独立越艰难，越需要投靠家庭找到安全感，反而更有利于生育率的提升。,5683801457,予致子,https://weibo.com/u/5683801457,我和你,其他,m,73,253,5,3,0,22,25,
5,5147388039138259,5365769881,2025-03-23 16:09:06,经济是真烂了，今年冬天我见到好几个女的，20－40岁的买男装羽绒服，原因是男装羽绒服比女装羽绒服便宜很多。很多店把一些男装羽绒服做得成黑白色一眼望上去不好分性别的，店员说卖的很火，不少女的去买。 她们是真没钱了,来自河南,5147391985452167,42,31,经济是真烂了，今年冬天我见到好几个女的，20－40岁的买男装羽绒服，原因是男装羽绒服比女装羽绒服便宜很多。很多店把一些男装羽绒服做得成黑白色一眼望上去不好分性别的，店员说卖的很火，不少女的去买。 她们是真没钱了,6170468311,抱琴听雨落,https://weibo.com/u/6170468311,落花,江苏,f,42,196,48,20,4,26,50,
6,5147388039138259,5365769881,2025-03-23 19:01:20,现在女的做错事了也是碰不得说不得，谁敢用哦，即使岁数大了也还是巨婴，完全只考虑自己，沉浸在自己公主的世界,来自广东,5147435329129157,19,108,现在女的做错事了也是碰不得说不得，谁敢用哦，即使岁数大了也还是巨婴，完全只考虑自己，沉浸在自己公主的世界,6857238952,失散多年的宝贝,https://weibo.com/u/6857238952,有多少偏见就有多少偏爱,上海,f,396,689,887,195,16,594,805,
7,5147388039138259,5365769881,2025-03-23 15:58:05,"请问，女同事去生孩子的时候，工作怎么办？<img alt=""[泪]"" title=""[泪]"" src=""https://face.t.sinajs.cn/t4/appstyle/expression/ext/normal/6e/2018new_leimu_org.png"" /><img alt=""[泪]"" title=""[泪]"" src=""https://face.t.sinajs.cn/t4/appstyle/expression/ext/normal/6e/2018new_leimu_org.png"" /><img alt=""[泪]"" title=""[泪]"" src=""https://face.t.sinajs.cn/t4/appstyle/expression/ext/normal/6e/2018new_leimu_org.png"" />",来自江苏,5147389212231156,12,19,请问，女同事去生孩子的时候，工作怎么办？[泪][泪][泪],1635155741,小顺他爸,https://weibo.com/u/1635155741, ,上海 虹口区,m,1758,1394,12129,"8,234","5,770",566,"14,570",
8,5147388039138259,5365769881,2025-03-23 21:44:01,"不要闭眼编好吧，调查下编制内男女比例，现实是现在体制内的工作都要考试，男生基本考不过女生<img alt=""[汗]"" title=""[汗]"" src=""https://face.t.sinajs.cn/t4/appstyle/expression/ext/normal/28/2018new_han_org.png"" />",来自江西,5147476269730350,18,19,不要闭眼编好吧，调查下编制内男女比例，现实是现在体制内的工作都要考试，男生基本考不过女生[汗],5722761651,十里彤云海,https://weibo.com/u/5722761651,然后知所谓勿欺者，随地可以自尽也,江西 赣州,f,207,229,696,940,121,"2,372","3,433",
9,5147388039138259,5365769881,2025-03-24 00:50:49,我们也不招女的，女的多了企业一准倒闭,来自北京,5147523284468270,31,36,我们也不招女的，女的多了企业一准倒闭,7954263134,新世界的爹,https://weibo.com/u/7954263134,,北京,m,164,128,1,5,0,0,5,
10,5147388039138259,5365769881,2025-03-23 16:36:35,如果一个女的拿子宫已切除的诊断证明去应聘，会不会更有利?,来自北京,5147398902647984,9,21,如果一个女的拿子宫已切除的诊断证明去应聘，会不会更有利?,7397471932,西楼望月知云深,https://weibo.com/u/7397471932,生死看淡，不服就干,其他,f,101,338,2665,774,146,"2,055","2,975",
11,5147388039138259,5365769881,2025-03-23 18:06:06,"十年前我单位招个女的，研究生，工作能力一般般吧，领导合计试用期内，不想用了。结果人家怀孕了，领导很无奈感觉中计了。产假结束后第二天这女的辞职了<img alt=""[允悲]"" title=""[允悲]"" src=""https://face.t.sinajs.cn/t4/appstyle/expression/ext/normal/83/2018new_kuxiao_org.png"" /><img alt=""[允悲]"" title=""[允悲]"" src=""https://face.t.sinajs.cn/t4/appstyle/expression/ext/normal/83/2018new_kuxiao_org.png"" /><img alt=""[允悲]"" title=""[允悲]"" src=""https://face.t.sinajs.cn/t4/appstyle/expression/ext/normal/83/2018new_kuxiao_org.png"" /><img alt=""[允悲]"" title=""[允悲]"" src=""https://face.t.sinajs.cn/t4/appstyle/expression/ext/normal/83/2018new_kuxiao_org.png"" /><img alt=""[允悲]"" title=""[允悲]"" src=""https://face.t.sinajs.cn/t4/appstyle/expression/ext/normal/83/2018new_kuxiao_org.png"" />",来自辽宁,5147421434184092,3,33,十年前我单位招个女的，研究生，工作能力一般般吧，领导合计试用期内，不想用了。结果人家怀孕了，领导很无奈感觉中计了。产假结束后第二天这女的辞职了[允悲][允悲][允悲][允悲][允悲],1199902294,凯迪不再拉客,https://weibo.com/u/1199902294,好好的吧，挺不容易的,辽宁 大连,m,2439,247,7092,367,947,508,"1,822",
12,5147388039138259,5365769881,2025-03-23 17:51:37,前人砍树，后人暴晒，自己作的,来自上海,5147417785144225,0,19,前人砍树，后人暴晒，自己作的,7836930389,一天三顿小烧烧烤031,https://weibo.com/u/7836930389,,北京 东城区,m,34,386,750,4,8,165,177,
13,5147388039138259,5365769881,2025-03-24 15:27:04,女性越难就业，越需要回归家庭，生育率反而会上升。,来自广西,5147743799214504,4,2,女性越难就业，越需要回归家庭，生育率反而会上升。,2125505664,啦哈吧纳,https://weibo.com/u/2125505664,,广西,m,48,477,7,1,0,3,4,
14,5147388039138259,5365769881,2025-03-23 16:05:12,可能怕动不动产假,来自四川,5147391003460316,3,2,可能怕动不动产假,7763682898,夹总滚蛋,https://weibo.com/u/7763682898,,海南 海口,m,25,257,165,5,2,126,133,
15,5147388039138259,5365769881,2025-03-23 21:58:44,看法正和你相反，过于主张权利而不讲贡献，谁愿招女的,来自安徽,5147479972775299,0,20,看法正和你相反，过于主张权利而不讲贡献，谁愿招女的,2692699864,嗅嗅听听,https://weibo.com/u/2692699864,喜欢关心时政，喜欢技术,安徽 马鞍山,m,132,380,207,78,50,45,173,
16,5147388039138259,5365769881,2025-03-24 08:02:18,"女权才是打压女性就业的根源<img alt=""[挖鼻]"" title=""[挖鼻]"" src=""https://face.t.sinajs.cn/t4/appstyle/expression/ext/normal/9a/2018new_wabi_thumb.png"" />",来自浙江,5147631866611322,3,7,女权才是打压女性就业的根源[挖鼻],6003604391,干掉那个共情怪,https://weibo.com/u/6003604391,极度厌男，厌女拳，爱好女，我是lsp，小仙女又要来定义我的性别啦,浙江,f,39,318,1681,"1,288",282,"8,262","9,832",
17,5147388039138259,5365769881,2025-03-23 18:00:15,在扯什么犊子，关键问题不是劳动者权利没有得到有效保护吗？,来自安徽,5147419960411497,0,12,在扯什么犊子，关键问题不是劳动者权利没有得到有效保护吗？,2711453291,薛岳夜,https://weibo.com/u/2711453291,所以然者，人之不廉而至于悖礼犯义，其原皆生于无耻也。故士大夫之无耻，谓之国耻。——顾炎武《日知录》,广东 揭阳,m,110,247,397,34,35,7,76,
18,5147388039138259,5365769881,2025-03-24 09:05:21,因为很多国企岗位（室外作业、熬夜）并不适合女生。,来自山东,5147647737594012,2,2,因为很多国企岗位（室外作业、熬夜）并不适合女生。,6434347447,穿越千山暮雪的人生孤旅,https://weibo.com/u/6434347447,,其他,f,273,467,8,2,0,37,39,
19,5147388039138259,5365769881,2025-03-24 11:51:35,评论里面有些人给我一种只在网上接触过女性的感觉，真可怜,来自四川,5147689567127259,0,17,评论里面有些人给我一种只在网上接触过女性的感觉，真可怜,2299375112,唯一的病人,https://weibo.com/u/2299375112,庐山烟雨浙江潮，未到千般恨不消。到得还来无别事，庐山烟雨浙江潮。,四川,f,73,140,266,70,51,136,257,
20,5147388039138259,5365769881,2025-03-24 09:16:54,一直都是男生比女生好找工作，很多年前就是这样。生理、心理有差异，用人企业也要盈利要生存，人家愿意选择更扛造的男性无可厚非。但评论里对怀孕、请假有意见是啥意思，生孩子影响工作了是吗，就不生了？,来自四川,5147650642936291,1,4,一直都是男生比女生好找工作，很多年前就是这样。生理、心理有差异，用人企业也要盈利要生存，人家愿意选择更扛造的男性无可厚非。但评论里对怀孕、请假有意见是啥意思，生孩子影响工作了是吗，就不生了？,6454304069,Xixi_Ech0,https://weibo.com/u/6454304069,花花、家欣是我心上熊,其他,f,46,2171,8146,"1,745",225,"1,257","3,227",
21,5147388039138259,5365769881,2025-03-23 18:59:57,"前人砍树，后人晒太阳<img alt=""[doge]"" title=""[doge]"" src=""https://face.t.sinajs.cn/t4/appstyle/expression/ext/normal/a1/2018new_doge02_org.png"" />",来自广西,5147434981786254,0,12,前人砍树，后人晒太阳[doge],5590919621,一拳穿星辰,https://weibo.com/u/5590919621,,其他,m,108,242,36,11,0,7,18,
22,5147388039138259,5365769881,2025-03-23 22:07:49,拉倒吧，少打些拳就招女生了，以前我们单位那么多女生，没见谁像男生一样卖力。,来自广东,5147482258671816,0,16,拉倒吧，少打些拳就招女生了，以前我们单位那么多女生，没见谁像男生一样卖力。,7452380512,这样那样都很好2025,https://weibo.com/u/7452380512,,广东,f,43,560,207,11,2,144,157,
23,5147388039138259,5365769881,2025-03-24 10:31:40,"🍠上到处都是上岸躺平指南，转正怀孕手册，我司招过两个转正怀孕的女同志后，招聘时先把女同志的简历放进碎纸机<img alt=""[挖鼻]"" title=""[挖鼻]"" src=""https://face.t.sinajs.cn/t4/appstyle/expression/ext/normal/9a/2018new_wabi_thumb.png"" />",来自福建,5147669454917046,0,7,🍠上到处都是上岸躺平指南，转正怀孕手册，我司招过两个转正怀孕的女同志后，招聘时先把女同志的简历放进碎纸机[挖鼻],7785043108,都可以膜,https://weibo.com/u/7785043108,,福建,m,58,1004,609,123,467,108,698,
24,5147388039138259,5365769881,2025-03-24 10:22:11,“你不能只在对自己有利的时候才赞美哈耶克的大手子”,来自上海,5147667068617873,0,14,“你不能只在对自己有利的时候才赞美哈耶克的大手子”,7631992680,喵斯拉大王二号机,https://weibo.com/u/7631992680,总有地上的生灵，敢于直面雷霆的威光,上海,m,1367552,2482,12911,"260,220","172,259","3,207,153","3,639,632",微博新知博主 军事博主 头条文章作者
25,5147388039138259,5365769881,2025-03-24 12:43:05,这个明显是女权造成的,来自浙江,5147702527792381,1,2,这个明显是女权造成的,6162284904,静水流深是不可能的,https://weibo.com/u/6162284904,,其他,f,40,428,8739,20,57,215,292,
26,5147388039138259,5365769881,2025-03-24 11:01:45,确实，来的时候说的特别好。进来了发现这也不会那也不肯干，也不学。,来自山西,5147677026161138,0,3,确实，来的时候说的特别好。进来了发现这也不会那也不肯干，也不学。,7961241390,无畏蜂蜜参观古迹,https://weibo.com/u/7961241390,,山西 长治,m,335,307,119,1,0,32,33,
27,5147388039138259,5365769881,2025-03-24 07:12:17,我老公脚肿了，但是出差，人家拄着拐杖去的，我问他，他手下的各位女同事还活着吗，他说看在钱不少的份上，都喘气呢,来自北京,5147619279505219,0,3,我老公脚肿了，但是出差，人家拄着拐杖去的，我问他，他手下的各位女同事还活着吗，他说看在钱不少的份上，都喘气呢,6530353585,妮妮和它它,https://weibo.com/u/6530353585,铲屎官一枚，像猫一样孤傲,北京,f,14,491,5051,13,2,224,239,
28,5147388039138259,5365769881,2025-03-23 16:12:47,"或者，没人能在被问是否近期计划怀孕，在回答有计划的情况下，还能找到工作，铁饭碗更不可能//<a href=/n/抱琴听雨落 usercard=""name=@抱琴听雨落"">@抱琴听雨落</a>:现实是除了铁饭碗里面的没有人能在怀孕期间找到工作。//<a href=/n/小顺他爸 usercard=""name=@小顺他爸"">@小顺他爸</a>:请问，女同事去生孩子的时候，工作怎么办？<img alt=""[泪]"" title=""[泪]"" src=""https://face.t.sinajs.cn/t4/appstyle/expression/ext/normal/6e/2018new_leimu_org.png"" /><img alt=""[泪]"" title=""[泪]"" src=""https://face.t.sinajs.cn/t4/appstyle/expression/ext/normal/6e/2018new_leimu_org.png"" /><img alt=""[泪]"" title=""[泪]"" src=""https://face.t.sinajs.cn/t4/appstyle/expression/ext/normal/6e/2018new_leimu_org.png"" />",来自广西,5147392915800863,0,2,或者，没人能在被问是否近期计划怀孕，在回答有计划的情况下，还能找到工作，铁饭碗更不可能//@抱琴听雨落:现实是除了铁饭碗里面的没有人能在怀孕期间找到工作。//@小顺他爸:请问，女同事去生孩子的时候，工作怎么办？[泪][泪][泪],5645897986,忒忒忒忒忒忒烦,https://weibo.com/u/5645897986,无药可救与无可救药的界线……,西藏 那曲,f,55,558,12908,306,746,"1,164","2,216",
29,5147388039138259,5365769881,2025-03-23 18:36:42,前人砍树，后人曝晒！,来自江苏,5147429129946445,0,7,前人砍树，后人曝晒！,1913909655,yiranhu,https://weibo.com/u/1913909655,,江苏 南京,m,387,718,1645,54,108,167,329,
30,5147388039138259,5365769881,2025-03-23 22:10:14,同意能够撤回   招了女生  领导有可能进去三年,来自浙江,5147482868425531,0,4,同意能够撤回   招了女生  领导有可能进去三年,7915187444,画着羊皮,https://weibo.com/u/7915187444,,其他,m,109,220,68,11,0,1,12,
31,5147388039138259,5365769881,2025-03-24 09:46:42,"正因为个例把事情弄极端了，才弄成现在这种情况。反而大多数人都这样的话，这种情况肯定不会出现。//<a href=/n/赵铮-同志 usercard=""name=@赵铮-同志"">@赵铮-同志</a>:拿极端个例向全部人开炮，会把恶劣行为合理化。问题出在人资联盟的压榨理论上，最终会导致女性没工作，男性变骡子。//<a href=/n/1随便改个名1 usercard=""name=@1随便改个名1"">@1随便改个名1</a>:如果一个性别频繁使用性别来索取更多的东西，你问出钱 ...<span class=""expand"">全文</span>",来自山西,5147658142352362,0,3,正因为个例把事情弄极端了，才弄成现在这种情况。反而大多数人都这样的话，这种情况肯定不会出现。//@赵铮-同志:拿极端个例向全部人开炮，会把恶劣行为合理化。问题出在人资联盟的压榨理论上，最终会导致女性没工作，男性变骡子。//@1随便改个名1:如果一个性别频繁使用性别来索取更多的东西，你问出钱,7947596456,0佛也0,https://weibo.com/u/7947596456,,山西 晋城,m,89,698,4064,115,253,221,589,
32,5147388039138259,5365769881,2025-03-24 08:57:30,其它行业我不知道，但在我们软件上，加班多，确实“心疼”女生，所以它们很少被过度加班折磨。 你作为小组长/产品经理/项目经理，你会选择男还是女？,来自江苏,5147645756573695,0,2,其它行业我不知道，但在我们软件上，加班多，确实“心疼”女生，所以它们很少被过度加班折磨。 你作为小组长/产品经理/项目经理，你会选择男还是女？,7907477614,NK-HAWK,https://weibo.com/u/7907477614,,北京,m,69,192,43,2,0,3,5,
33,5147388039138259,5365769881,2025-03-24 08:09:14,很多体制内的编制岗都是一个萝卜一个坑。不招女生两个原因。一个是产假期间岗位上就是缺个人，这个老生常谈了。第二是这种编制岗总有忙和闲。很有可能一个人忙成狗，周围一圈人闲得刷手机，哪个女的吃亏了能不闹？,来自上海,5147633610133647,0,3,很多体制内的编制岗都是一个萝卜一个坑。不招女生两个原因。一个是产假期间岗位上就是缺个人，这个老生常谈了。第二是这种编制岗总有忙和闲。很有可能一个人忙成狗，周围一圈人闲得刷手机，哪个女的吃亏了能不闹？,7210997919,无敌小光3344,https://weibo.com/u/7210997919,,其他,m,94,201,288,24,3,81,108,
34,5147388039138259,5365769881,2025-03-23 23:28:47,装清纯吗？？同样的价格，你买质量好的还是差的？,来自黑龙江,5147502639317692,0,8,装清纯吗？？同样的价格，你买质量好的还是差的？,6243984380,匹夫之怒o,https://weibo.com/u/6243984380,只收听👂不广播🤐,北京,f,481416,549,520,43,101,77,221,
35,5147388039138259,5365769881,2025-03-23 20:33:17,作为用人单位来说，尤其是企业，这也是没有办法的事情。现在工作都很卷，招女生，尤其是研究生，马上面临着结婚、生娃，两个娃生下来，怀孕后期肯定不能劳累，还有两份产假、育儿假，3-5年就这样过去了，单位的工作怎么办？效益怎么办？（国有企业现在利润的考核权重至少都在30%以上）,来自江西,5147458473820662,0,3,作为用人单位来说，尤其是企业，这也是没有办法的事情。现在工作都很卷，招女生，尤其是研究生，马上面临着结婚、生娃，两个娃生下来，怀孕后期肯定不能劳累，还有两份产假、育儿假，3-5年就这样过去了，单位的工作怎么办？效益怎么办？（国有企业现在利润的考核权重至少都在30%以上）,1931426713,RealSpartacus,https://weibo.com/u/1931426713,生气的时候，开口前先数到十，如果非常愤怒，先数到一百,江西 抚州,m,343,2753,254,,,,,
36,5147388039138259,5365769881,2025-03-25 00:33:05,因为前面的人把路走窄了啊，试用期刚过转正第二天怀孕的人会不会想因为她这个单位会再也不招女的,来自北京,5147881205664116,0,1,因为前面的人把路走窄了啊，试用期刚过转正第二天怀孕的人会不会想因为她这个单位会再也不招女的,7962114852,步骤兄弟我是史塔克,https://weibo.com/u/7962114852,,北京,m,12,214,105,11,12,258,281,
37,5147388039138259,5365769881,2025-03-24 23:42:55,资本有逐利性，追求利润最大化。如国家资本、私人资本都是如此。,来自湖北,5147868578975080,0,1,资本有逐利性，追求利润最大化。如国家资本、私人资本都是如此。,7752778163,明月几时无多时,https://weibo.com/u/7752778163,,湖北,f,4,420,78,11,0,97,108,
38,5147388039138259,5365769881,2025-03-23 18:52:27,"不会的，女找不到工作就会去找男人<img alt=""[笑cry]"" title=""[笑cry]"" src=""https://face.t.sinajs.cn/t4/appstyle/expression/ext/normal/4a/2018new_xiaoku_thumb.png"" /><img alt=""[笑cry]"" title=""[笑cry]"" src=""https://face.t.sinajs.cn/t4/appstyle/expression/ext/normal/4a/2018new_xiaoku_thumb.png"" /><img alt=""[笑cry]"" title=""[笑cry]"" src=""https://face.t.sinajs.cn/t4/appstyle/expression/ext/normal/4a/2018new_xiaoku_thumb.png"" />",来自福建,5147433093302248,11,1,不会的，女找不到工作就会去找男人[笑cry][笑cry][笑cry],5793977063,zjzq2015,https://weibo.com/u/5793977063,,福建 三明,m,291,859,914,24,143,38,205,
39,5147388039138259,5365769881,2025-03-23 19:25:32,也许纯纯就是怕了,来自天津,5147441419785011,0,2,也许纯纯就是怕了,1030775211,老城1840,https://weibo.com/u/1030775211,,天津 东丽区,m,454,545,3667,73,41,76,190,
40,5147388039138259,5365769881,2025-03-24 15:53:35,有一些人作的结果把所有人都连累了,来自河北,5147750468158089,0,1,有一些人作的结果把所有人都连累了,6371460544,我真无聊,https://weibo.com/u/6371460544,,其他,m,365,924,192,61,1,322,384,
41,5147388039138259,5365769881,2025-03-24 11:23:13,生育率高的时候，女性就业没现在这么难。,来自湖北,5147682429209765,0,2,生育率高的时候，女性就业没现在这么难。,1495517963,庆国草民,https://weibo.com/u/1495517963,我希望庆国的人民都能成为不羁之民，受他人虐待时有不屈服之心，受灾难侵袭时有不受挫折之心，若有不正之事时，不恐惧修正之心，不向豺狼献媚。,其他,m,192,165,632,194,283,112,589,
42,5147388039138259,5365769881,2025-03-28 06:49:01,归根结底是私有制。,来自江西,5149062974670462,0,0,归根结底是私有制。,3961670207,仍为韘觿,https://weibo.com/u/3961670207,用我们自己的双手，去创造一个吃得饱、穿的暖，不被人看不起的种花家。,江西,f,226,1129,2663,72,653,464,"1,189",
43,5147388039138259,5365769881,2025-03-26 10:22:34,"女的可以创业做大女主啊<img alt=""[doge]"" title=""[doge]"" src=""https://face.t.sinajs.cn/t4/appstyle/expression/ext/normal/a1/2018new_doge02_org.png"" />",来自广西,5148391940033542,0,0,女的可以创业做大女主啊[doge],7569097539,三千万舔狗龜男总教头,https://weibo.com/u/7569097539,,其他,f,3,254,142,1,3,0,4,
44,5147388039138259,5365769881,2025-03-25 07:36:18,"之前在一家央企的三级单位工作，然后辞职了，因为招聘的时候，领导对我说，看简历先筛选性别，女的全不要。<img alt=""[吐]"" title=""[吐]"" src=""https://face.t.sinajs.cn/t4/appstyle/expression/ext/normal/08/2018new_tu_org.png"" />然后我就辞职了，因为这个公司里的女的，都是领导媳妇，我不想融入这个环境<img alt=""[吐]"" title=""[吐]"" src=""https://face.t.sinajs.cn/t4/appstyle/expression/ext/normal/08/2018new_tu_org.png"" />",来自四川,5147987711624815,0,0,之前在一家央企的三级单位工作，然后辞职了，因为招聘的时候，领导对我说，看简历先筛选性别，女的全不要。[吐]然后我就辞职了，因为这个公司里的女的，都是领导媳妇，我不想融入这个环境[吐],5510382413,呈凡ichi44,https://weibo.com/u/5510382413,4嬷，磕所有all4右。松野一松就是老婆啊！目前主磕14❤️💜和24💙💜，雷一切双洁，洁癖姐滚远点。,其他,f,34,306,382,327,9,320,656,
45,5147388039138259,5365769881,2025-03-25 06:05:13,f f,来自江苏,5147964788179422,0,0,f f,3291193550,无处虔诚,https://weibo.com/u/3291193550,,江苏 无锡,m,343,778,929,46,2,11,59,
