,main_body_mid,main_body_uid,发布时间,处理内容,评论地点,mid,回复数量,点赞数量,原生内容,uid,用户昵称,用户主页,用户描述,用户地理位置,用户性别,用户粉丝数量,用户关注数量,用户全部微博,用户累计评论,用户累计转发,用户累计获赞,用户转评赞
0,5149087901158384,5647757289,2025-03-28 09:14:28,"通过集体恐吓和造黄谣，系统性地将这个职业里的女性驱逐，若干年后，就可以说这个职业没有女性，是因为女性胜任不了<img alt=""[拳头]"" title=""[拳头]"" src=""https://face.t.sinajs.cn/t4/appstyle/expression/ext/normal/86/2018new_quantou_org.png"" />",来自浙江,5149099582554581,2,377,通过集体恐吓和造黄谣，系统性地将这个职业里的女性驱逐，若干年后，就可以说这个职业没有女性，是因为女性胜任不了[拳头],5352784845,道听途-,https://weibo.com/u/5352784845,该账号因被投诉违反《微博社区公约》的相关规定，现已无法查看。,海外 塞浦路斯,f,14,292,2403,356,249,112,717
1,5149087901158384,5647757289,2025-03-28 08:35:22,不是，公司里带男秘书就没可能同？,来自河北,5149089738788500,1,104,不是，公司里带男秘书就没可能同？,7947425610,用户7947425610,https://weibo.com/u/7947425610,斯,浙江 绍兴,f,97,147,119,28,0,20,48
2,5149087901158384,5647757289,2025-03-28 13:47:08,"前高管助理表示非常认同<img alt=""[作揖]"" title=""[作揖]"" src=""https://face.t.sinajs.cn/t4/appstyle/expression/ext/normal/e7/2018new_zuoyi_org.png"" />我司8个高管（6男2女），配的9个助理里只有2个男的。除了少数高管会因为家属要求指定助理性别外，绝大部分高管都是工作狂，选助理核心只看工作能力，且都会尽可能和异性助理保持距离",来自湖南,5149168197702880,0,50,前高管助理表示非常认同[作揖]我司8个高管（6男2女），配的9个助理里只有2个男的。除了少数高管会因为家属要求指定助理性别外，绝大部分高管都是工作狂，选助理核心只看工作能力，且都会尽可能和异性助理保持距离,5703342192,帅比老男友,https://weibo.com/u/5703342192,什么鬼？！,北京 东城区,f,703,3672,38864,"3,652","35,624","17,676","56,952"
3,5149087901158384,5647757289,2025-03-28 09:52:40,哈哈哈让我想起来日本和欧美刚允许女性进入职场的时候，大家都默认女员工是给男员工上班时候也可以调戏女人的福利。,来自北京,5149109196685777,0,43,哈哈哈让我想起来日本和欧美刚允许女性进入职场的时候，大家都默认女员工是给男员工上班时候也可以调戏女人的福利。,5840474149,少女听雨歌楼,https://weibo.com/u/5840474149,LGBT/LES/GAY/新建文件夹/防搜,北京,f,63,1570,542,9,221,147,377
4,5149087901158384,5647757289,2025-03-28 09:31:48,"我们公司总助就是男的<img alt=""[可爱]"" title=""[可爱]"" src=""https://face.t.sinajs.cn/t4/appstyle/expression/ext/normal/09/2018new_keai_org.png"" />",来自海南,5149103941486985,0,3,我们公司总助就是男的[可爱],5696731357,杀杀咩咩咩个蛋蛋,https://weibo.com/u/5696731357,nsdd！,海南 海口,f,10,364,679,118,3,19,140
5,5149087901158384,5647757289,2025-04-04 21:28:27,"说得太好了<img alt=""[good]"" title=""[good]"" src=""https://face.t.sinajs.cn/t4/appstyle/expression/ext/normal/8a/2018new_good_org.png"" />",来自广东,5151821006641415,0,0,说得太好了[good],2164711620,亲爱的水果糖,https://weibo.com/u/2164711620,,广东 广州,f,153,397,2524,125,54,156,335
