,main_body_mid,main_body_uid,发布时间,处理内容,评论地点,mid,回复数量,点赞数量,原生内容,uid,用户昵称,用户主页,用户认证信息,用户描述,用户地理位置,用户性别,用户粉丝数量,用户关注数量,用户全部微博,用户累计评论,用户累计转发,用户累计获赞,用户转评赞
0,5154192017855009,5796516407,2025-04-11 17:45:34,你是我漫漫余生里义无反顾的梦想🧡ྀི💛ྀི❤️ྀི,来自黑龙江,5154301631530947,0,1,你是我漫漫余生里义无反顾的梦想🧡ྀི💛ྀི❤️ྀི,7532519297,老大快现身N,https://weibo.com/u/7532519297,超话创作官（电视剧折腰超话）,尽快毕业，早日进棚,其他,f,12741,2292,7046,"588,730","187,012","68,070","843,812"
1,5154192017855009,5796516407,2025-04-12 08:29:23,我曾在人山人海的星光里为你嘶声呐喊 最美好的岁月都与你有关,来自河北,5154524050490404,0,0,我曾在人山人海的星光里为你嘶声呐喊 最美好的岁月都与你有关,7934013776,Fireworks-温旧街晚,https://weibo.com/u/7934013776,超话粉丝钻咖（王俊凯超话）,爱的开篇:小螃蟹的iPhone,河北,f,4236,701,599,,,,
2,5154192017855009,5796516407,2025-04-12 07:34:30,"🌿<a href=""//s.weibo.com/weibo?q=%23%E9%98%B3%E5%85%89%E4%BF%A1%E7%94%A8%23"" target=""_blank"">#阳光信用#</a>倡导富强、民主、文明、和谐，倡导自由、平等、公正、法治，倡导爱国、敬业、诚信、友善，积极培育和践行社会主义核心价值观，弘扬爱国主义精神，必须坚持立足民族又面向世界。",来自广西,5154510238385900,0,0,🌿#阳光信用#倡导富强、民主、文明、和谐，倡导自由、平等、公正、法治，倡导爱国、敬业、诚信、友善，积极培育和践行社会主义核心价值观，弘扬爱国主义精神，必须坚持立足民族又面向世界。,7923731661,邓也是彧,https://weibo.com/u/7923731661,,碗盆,其他,m,2574,133,288,"1,876","19,650",409,"21,935"
3,5154192017855009,5796516407,2025-04-12 07:27:42,勿起不善之念，勿阅不善之书，勿听不善之乐，勿吐不善之语，勿为不善之事，勿近不善之人，勿学不善之法，勿入不善之境。,来自广西,5154508527108634,0,0,勿起不善之念，勿阅不善之书，勿听不善之乐，勿吐不善之语，勿为不善之事，勿近不善之人，勿学不善之法，勿入不善之境。,7703522814,Lisong-厨国就是王,https://weibo.com/u/7703522814,超话粉丝钻咖（文轩超话）,“那你叫我老公”,其他,m,12507,670,6035,"35,931","1,264,630","4,493","1,305,054"
4,5154192017855009,5796516407,2025-04-11 22:31:55,"加油<img alt=""[good]"" title=""[good]"" src=""https://face.t.sinajs.cn/t4/appstyle/expression/ext/normal/8a/2018new_good_org.png"" />",来自贵州,5154373692822992,0,0,加油[good],7818393114,鞠皖艳a,https://weibo.com/u/7818393114,,🈲单曲,其他,f,3754,2451,2055,"17,686","340,852","7,060","365,598"
5,5154192017855009,5796516407,2025-04-11 22:01:17,&quot;我很想你但我见不到你我喜欢花但我够不到&quot;,来自广西,5154365985267925,0,0,"""我很想你但我见不到你我喜欢花但我够不到""",7961134211,小烤魚-Rainco,https://weibo.com/u/7961134211,,@肖宇梁天天开心,其他,f,4364,4341,209,,,,
6,5154192017855009,5796516407,2025-04-11 20:51:19,你或许很辛苦，跌跌撞撞一身伤，在状态里写下委屈抱怨，也许会有人安慰你，但不会感同身受。这个世界就是这样，只能看到胜利者的汗，却看不到失败者的泪。,来自湖北,5154348377835581,0,0,你或许很辛苦，跌跌撞撞一身伤，在状态里写下委屈抱怨，也许会有人安慰你，但不会感同身受。这个世界就是这样，只能看到胜利者的汗，却看不到失败者的泪。,7879494335,冰椰茶糕,https://weibo.com/u/7879494335,娱乐博主 超话粉丝钻咖（王俊凯超话）,peace and love,其他,f,1075,1123,1981,"18,660",106,"5,070","23,836"
7,5154192017855009,5796516407,2025-04-11 20:00:54,感恩生活中的每一份给予，它们塑造了今天的你。,来自江苏,5154335689808441,0,0,感恩生活中的每一份给予，它们塑造了今天的你。,5984065378,阮薇Koreyoshi,https://weibo.com/u/5984065378,娱乐博主 超话粉丝钻咖（鞠婧祎超话）,鞠婧祎,江苏,f,4359,590,7444,"37,199","340,853","11,607","389,659"
8,5154192017855009,5796516407,2025-04-11 19:31:48,“玫瑰散发着芳香，风声诉说着思念”𝒯𝒽𝓮 𝓇𝓸𝓈𝓮𝓈 𝒶𝓇𝓮 𝒻𝓇𝒶𝓰𝓇𝒶𝓃𝓉 𝒶𝓃𝒹 𝓉𝒽𝓮 𝓌𝒾𝓃𝒹 𝒾𝓈 𝓉𝓈𝓈𝒾𝓃𝓰.,来自山西,5154328365499653,0,0,“玫瑰散发着芳香，风声诉说着思念”𝒯𝒽𝓮 𝓇𝓸𝓈𝓮𝓈 𝒶𝓇𝓮 𝒻𝓇𝒶𝓰𝓇𝒶𝓃𝓉 𝒶𝓃𝒹 𝓉𝒽𝓮 𝓌𝒾𝓃𝒹 𝒾𝓈 𝓉𝓈𝓈𝒾𝓃𝓰.,7749286926,Angela_茉冬敬亭语,https://weibo.com/u/7749286926,,,其他,f,1181,1340,941,"15,344",79,"1,043","16,466"
9,5154192017855009,5796516407,2025-04-11 18:18:55,“星辰晦暗 风总在迷茫中狂野 少年借着星光成长” &quot;𝓣𝓱𝓮 𝓭𝓪𝓻𝓴 𝔀𝓲𝓷𝓭 𝓸𝓯 𝓽𝓱𝓮 𝓼𝓽𝓪𝓻𝓼 𝓲𝓼 𝓪𝓵𝔀𝓪𝔂𝓼 𝓲𝓷,来自江苏,5154310025126116,0,0,"“星辰晦暗 风总在迷茫中狂野 少年借着星光成长” ""𝓣𝓱𝓮 𝓭𝓪𝓻𝓴 𝔀𝓲𝓷𝓭 𝓸𝓯 𝓽𝓱𝓮 𝓼𝓽𝓪𝓻𝓼 𝓲𝓼 𝓪𝓵𝔀𝓪𝔂𝓼 𝓲𝓷",7967347500,祎43,https://weibo.com/u/7967347500,,ಣ,江苏 徐州,f,1085,223,765,"11,427","34,484",943,"46,854"
10,5154192017855009,5796516407,2025-04-12 16:46:02,你是我寡淡无味的青春里很特别的存在 𝒀𝒐𝒖 𝒂𝒓𝒆 𝒂 𝒔𝒑𝒆𝒄𝒊𝒂𝒍 𝒆𝒙𝒊𝒔𝒕𝒆𝒏𝒄𝒆 𝒊𝒏 𝒎𝒚 𝒅𝒖𝒍𝒍 𝒚𝒐𝒖𝒕𝒉🦋,来自广东,5154649036558348,0,0,你是我寡淡无味的青春里很特别的存在 𝒀𝒐𝒖 𝒂𝒓𝒆 𝒂 𝒔𝒑𝒆𝒄𝒊𝒂𝒍 𝒆𝒙𝒊𝒔𝒕𝒆𝒏𝒄𝒆 𝒊𝒏 𝒎𝒚 𝒅𝒖𝒍𝒍 𝒚𝒐𝒖𝒕𝒉🦋,7808678923,婧祎如履薄冰的十一年,https://weibo.com/u/7808678923,,如果爱婧祎是种天赋、,其他,f,1635,906,865,"23,728",310,"2,304","26,342"
11,5154192017855009,5796516407,2025-04-12 10:15:15,“在我的这颗小星球里面，你就是温柔跟璀璨，即使旁的宇宙再浪漫，我也终身不换”,来自马来西亚,5154550693498741,0,0,“在我的这颗小星球里面，你就是温柔跟璀璨，即使旁的宇宙再浪漫，我也终身不换”,5452935794,凉亭里有个彤学,https://weibo.com/u/5452935794,,,其他,f,2,27,4,62,0,13,75
12,5154192017855009,5796516407,2025-04-12 09:06:26,生命中总会遇到或多或少的问题，很多时候我们都在面对选择，总是会有犹豫也会有彷徨，但是无论是做什么样的决定，都要相信自己，不为过去而忧虑，不为错过而后悔。,来自广西,5154533374691615,0,0,生命中总会遇到或多或少的问题，很多时候我们都在面对选择，总是会有犹豫也会有彷徨，但是无论是做什么样的决定，都要相信自己，不为过去而忧虑，不为错过而后悔。,7847628978,简耽昂,https://weibo.com/u/7847628978,,航唯 @TOP登陆少-年左航,广西 百色,f,1205,354,6805,"14,684","1,684","4,338","20,706"
13,5154192017855009,5796516407,2025-04-12 01:53:29,"&quot;即使藏住了心底暗涌澎湃的爱意,仍无法移开对你痴情眷恋的眼。&quot;",来自河北,5154424420567291,0,0,"""即使藏住了心底暗涌澎湃的爱意,仍无法移开对你痴情眷恋的眼。""",7939384587,Stellear_記吟緒酒,https://weibo.com/u/7939384587,,,上海,f,573,88,23256,278,187,45,510
14,5154192017855009,5796516407,2025-04-11 22:45:52,"&quot;浪漫可以是形容词,也可以是名词,但我认为它是代词--代指你.&quot;",来自江苏,5154377204765421,0,0,"""浪漫可以是形容词,也可以是名词,但我认为它是代词--代指你.""",6529760533,baby的小婧,https://weibo.com/u/6529760533,,杨家大军 如颖随行  小小世界  我只爱爱大笑的文艺青年angelababy  爱你永无止境@angelababy  不看订阅消息  正主超话13级 单曲不吱的hxm是你老公,其他,f,2901,2838,7085,"50,261","3,387","70,258","123,906"
15,5154192017855009,5796516407,2025-04-11 22:22:07,面对困难、挫折、挑战只要你肯相信自我，不断努力的付出，哪怕你现在的人生是从零开始，你都可以做得到。,来自江西,5154371231023144,0,0,面对困难、挫折、挑战只要你肯相信自我，不断努力的付出，哪怕你现在的人生是从零开始，你都可以做得到。,7938540439,小鱼干的兵3号,https://weibo.com/u/7938540439,,,其他,f,555,82,4865,26,1,12,39
16,5154192017855009,5796516407,2025-04-11 22:07:07,“世界之大，如果有缘我们终会在对的时间对的地点相遇”,来自内蒙古,5154367451694975,0,0,“世界之大，如果有缘我们终会在对的时间对的地点相遇”,7753013175,Esther_小虞游入余塘,https://weibo.com/u/7753013175,娱乐博主 超话粉丝钻咖（虞书欣超话） 微博原创视频博主,虞书欣  余承恩,内蒙古,f,2662,2120,1544,"68,532","3,247,040","31,068","3,346,640"
17,5154192017855009,5796516407,2025-04-11 19:44:51,"没有人可以规定风的形状  没有人可以规定你怎样发光. 𝓝𝓸 𝓸𝓷𝓮 𝓬𝓪𝓷 𝓭𝓭, 𝓷𝓸 𝓸𝓷𝓮 𝓬𝓪𝓷 𝓭𝓲𝓬𝓽𝓪𝓽𝓮 𝓱𝓸𝔀 𝔂𝓸𝓾.",来自四川,5154331650429087,0,0,"没有人可以规定风的形状  没有人可以规定你怎样发光. 𝓝𝓸 𝓸𝓷𝓮 𝓬𝓪𝓷 𝓭𝓭, 𝓷𝓸 𝓸𝓷𝓮 𝓬𝓪𝓷 𝓭𝓲𝓬𝓽𝓪𝓽𝓮 𝓱𝓸𝔀 𝔂𝓸𝓾.",7951189641,续集正宫,https://weibo.com/u/7951189641,,触摸不到的你、,四川 成都,f,18,59,41,54,63,7,124
18,5154192017855009,5796516407,2025-04-11 19:14:57,🍰𝓮𝒶𝒸𝒽 𝓸𝓊💜𝓉 𝒶𝓃𝒹 𝓁𝓮𝒶𝓋𝓮 𝓎𝓸𝓊𝓇 𝓂𝒶𝓇𝓀 𝓸𝓃 𝓂𝓎 𝒽𝓮𝒶𝓇𝓉💜伸出手 在我心上留下你的记号,来自广东,5154324130562555,0,0,🍰𝓮𝒶𝒸𝒽 𝓸𝓊💜𝓉 𝒶𝓃𝒹 𝓁𝓮𝒶𝓋𝓮 𝓎𝓸𝓊𝓇 𝓂𝒶𝓇𝓀 𝓸𝓃 𝓂𝓎 𝒽𝓮𝒶𝓇𝓉💜伸出手 在我心上留下你的记号,7808678923,婧祎如履薄冰的十一年,https://weibo.com/u/7808678923,,如果爱婧祎是种天赋、,其他,f,1635,906,865,"23,728",310,"2,304","26,342"
19,5154192017855009,5796516407,2025-04-11 18:53:05,"镜头里的对视，哪怕是隔着屏幕 我也能感觉到你的灵魂炽热耀眼” &quot;𝓛𝓸𝓸𝓴𝓲𝓷𝓰 𝓪𝓽 𝓮𝓪𝓬𝓱 𝓸𝓽𝓱𝓮𝓻 𝓲𝓷 𝓽𝓱𝓮 𝓵𝓮𝓷𝓼, 𝓮𝓿𝓮𝓷 𝓪𝓬𝓻𝓸𝓼𝓼 𝓽𝓱𝓮 𝓼𝓬𝓻𝓮𝓮𝓷.&quot;",来自四川,5154318625801030,0,0,"镜头里的对视，哪怕是隔着屏幕 我也能感觉到你的灵魂炽热耀眼” ""𝓛𝓸𝓸𝓴𝓲𝓷𝓰 𝓪𝓽 𝓮𝓪𝓬𝓱 𝓸𝓽𝓱𝓮𝓻 𝓲𝓷 𝓽𝓱𝓮 𝓵𝓮𝓷𝓼, 𝓮𝓿𝓮𝓷 𝓪𝓬𝓻𝓸𝓼𝓼 𝓽𝓱𝓮 𝓼𝓬𝓻𝓮𝓮𝓷.""",7948827909,Ning星星爱月亮,https://weibo.com/u/7948827909,超话粉丝钻咖（文轩超话）,我自年少，韶华倾负。,其他,f,1163,92,465,"29,082",22,"5,432","34,536"
20,5154192017855009,5796516407,2025-04-11 17:11:38,“即使是萤火般的星火，在你身上也会闪烁出光芒𝓔𝓋𝓮𝓃 𝓉𝒽𝓮 𝒻𝒾𝓇𝓮𝒻𝓁𝓎-𝓁𝒾𝓀𝓮 𝓁𝒾𝓰𝒽𝓉 𝓌𝒾𝓁𝓁 𝓇𝓮𝒻𝓁𝓮𝒸𝓉 𝒻𝓁𝒾𝒸𝓀𝓮𝓇 𝓸𝓃 𝓎”,来自河北,5154293091926767,0,0,“即使是萤火般的星火，在你身上也会闪烁出光芒𝓔𝓋𝓮𝓃 𝓉𝒽𝓮 𝒻𝒾𝓇𝓮𝒻𝓁𝓎-𝓁𝒾𝓀𝓮 𝓁𝒾𝓰𝒽𝓉 𝓌𝒾𝓁𝓁 𝓇𝓮𝒻𝓁𝓮𝒸𝓉 𝒻𝓁𝒾𝒸𝓀𝓮𝓇 𝓸𝓃 𝓎”,7408652800,Psyche_甯婧枝,https://weibo.com/u/7408652800,超话粉丝大咖（鞠婧祎超话）,有生命力的车水马龙就是春天,广东,f,11122,1187,4546,"36,600","27,830","8,470","72,900"
21,5154192017855009,5796516407,2025-04-11 14:11:30,"&quot;即使藏住了心底暗涌澎湃的爱意,仍无法移开对你痴情眷恋的眼。&quot;",来自河北,5154247759627710,0,0,"""即使藏住了心底暗涌澎湃的爱意,仍无法移开对你痴情眷恋的眼。""",7796865215,ID宋肆曦,https://weibo.com/u/7796865215,超话粉丝钻咖（文轩超话）,🔝宋亚轩刘耀文 不看消息 574 有事找@ID宋玄軒,其他,f,1141,154,3064,"4,328",644,773,"5,745"
22,5154192017855009,5796516407,2025-04-11 13:56:50,"&quot;芽破泥泞承风雪,花开自后万蝶来",来自江苏,5154244068117384,0,0,"""芽破泥泞承风雪,花开自后万蝶来",7930715202,KIKU_鞠素祎,https://weibo.com/u/7930715202,,,江苏 徐州,f,5,59,40,9,0,8,17
23,5154192017855009,5796516407,2025-04-11 13:20:46,"“晚风依旧，夕阳绚烂，满眼皆是你𝒯𝒽𝓮𝓃𝒾𝓰𝒽𝓉𝓌𝒾𝓃𝒹𝒾𝓈𝓈𝓉𝒾𝓁𝓁,𝓉𝒽𝓮𝓈𝓮𝓉𝓉𝒾𝓃𝓰𝓈𝓊𝓃𝒾𝓈𝓰𝓸",来自广西,5154234991382326,0,0,"“晚风依旧，夕阳绚烂，满眼皆是你𝒯𝒽𝓮𝓃𝒾𝓰𝒽𝓉𝓌𝒾𝓃𝒹𝒾𝓈𝓈𝓉𝒾𝓁𝓁,𝓉𝒽𝓮𝓈𝓮𝓉𝓉𝒾𝓃𝓰𝓈𝓊𝓃𝒾𝓈𝓰𝓸",7969560666,左千铭,https://weibo.com/u/7969560666,,,其他,f,25,51,1172,527,57,144,728
24,5154192017855009,5796516407,2025-04-11 13:16:29,"“晚风依旧，夕阳绚烂，满眼皆是你𝒯𝒽𝓮𝓃𝒾𝓰𝒽𝓉𝓌𝒾𝓃𝒹𝒾𝓈𝓈𝓉𝒾𝓁𝓁,𝓉𝒽𝓮𝓈𝓮𝓉𝓉𝒾𝓃𝓰𝓈𝓊𝓃𝒾𝓈𝓰𝓸",来自广西,5154233914493682,0,0,"“晚风依旧，夕阳绚烂，满眼皆是你𝒯𝒽𝓮𝓃𝒾𝓰𝒽𝓉𝓌𝒾𝓃𝒹𝒾𝓈𝓈𝓉𝒾𝓁𝓁,𝓉𝒽𝓮𝓈𝓮𝓉𝓉𝒾𝓃𝓰𝓈𝓊𝓃𝒾𝓈𝓰𝓸",7797657356,苏玖洛QM,https://weibo.com/u/7797657356,,,其他,f,141,192,4484,"8,124",387,"1,668","10,179"
25,5154192017855009,5796516407,2025-04-11 11:26:10,追随光 我对你的爱意永远热烈真诚 𝓕𝓸𝓵𝓵𝓸𝔀 𝓽𝓱𝓮 𝓵𝓲𝓰𝓱𝓽 𝓶𝔂 𝓵𝓸𝓿𝓮 𝓯𝓸𝓻 𝔂𝓸𝓾 𝔀𝓲𝓵𝓵 𝓪𝓵𝔀𝓪𝔂𝓼 𝓫𝓮 𝔀𝓪𝓻𝓶 𝓪𝓷𝓭 𝓼𝓲𝓷𝓬𝓮,来自陕西,5154206156587291,0,0,追随光 我对你的爱意永远热烈真诚 𝓕𝓸𝓵𝓵𝓸𝔀 𝓽𝓱𝓮 𝓵𝓲𝓰𝓱𝓽 𝓶𝔂 𝓵𝓸𝓿𝓮 𝓯𝓸𝓻 𝔂𝓸𝓾 𝔀𝓲𝓵𝓵 𝓪𝓵𝔀𝓪𝔂𝓼 𝓫𝓮 𝔀𝓪𝓻𝓶 𝓪𝓷𝓭 𝓼𝓲𝓷𝓬𝓮,7939305678,奕恒烟火-,https://weibo.com/u/7939305678,,,其他,f,11,92,259,346,"8,608",66,"9,020"
26,5154192017855009,5796516407,2025-04-12 08:42:03,你若拥有一颗宽容善良的心，你就会拥有快乐，你若拥有充满生机的心，你就会拥有健康幸福，其实生容易，活容易，生活却不易。若把心比做路，心宽路就宽，越走越舒坦。,来自江西,5154527243403683,0,0,你若拥有一颗宽容善良的心，你就会拥有快乐，你若拥有充满生机的心，你就会拥有健康幸福，其实生容易，活容易，生活却不易。若把心比做路，心宽路就宽，越走越舒坦。,7980661107,樱井意,https://weibo.com/u/7980661107,,,江西,f,9,22,10,9,"1,239",6,"1,254"
27,5154192017855009,5796516407,2025-04-11 19:54:47,“唯有你的光辉，能像漫过山岭的薄雾”𝑂𝑛𝑙𝑦 𝑦𝑜𝑢𝑟 𝑏𝑟𝑖𝑙𝑙𝑖𝑎𝑛𝑐𝑒 𝑐𝑎𝑛 𝑏𝑒 𝑙𝑖𝑘𝑒 𝑡ℎ𝑒 𝑚𝑖𝑠𝑡 𝑜𝑣𝑒𝑟 𝑡ℎ𝑒 𝑚𝑜𝑢𝑛𝑡𝑎𝑖𝑛𝑠.,来自广西,5154334153114649,0,0,“唯有你的光辉，能像漫过山岭的薄雾”𝑂𝑛𝑙𝑦 𝑦𝑜𝑢𝑟 𝑏𝑟𝑖𝑙𝑙𝑖𝑎𝑛𝑐𝑒 𝑐𝑎𝑛 𝑏𝑒 𝑙𝑖𝑘𝑒 𝑡ℎ𝑒 𝑚𝑖𝑠𝑡 𝑜𝑣𝑒𝑟 𝑡ℎ𝑒 𝑚𝑜𝑢𝑛𝑡𝑎𝑖𝑛𝑠.,7986311894,枝枝吃妤-卫枝版,https://weibo.com/u/7986311894,,“否极泰来，物极必反”,其他,f,4,14,115,132,1,14,147
28,5154192017855009,5796516407,2025-04-12 11:35:01,"“那我就是摄像头会对焦而主角是你永远是你”𝓢𝓸 𝓘 𝓪𝓶 𝓽𝓱𝓮 𝓬𝓪𝓶𝓮𝓻𝓪 𝓽𝓱𝓪𝓽 𝓯𝓸𝓬𝓾𝓼𝓮𝓼,𝓪𝓷𝓭 𝓽𝓱𝓮 𝓹𝓻𝓸𝓽𝓪𝓰𝓸𝓷𝓲𝓼𝓽 𝓲𝓼 𝔂𝓸𝓾 𝓪𝓵𝔀𝓪𝔂𝓼 𝔂𝓸𝓾.",来自广西,5154570766388224,0,0,"“那我就是摄像头会对焦而主角是你永远是你”𝓢𝓸 𝓘 𝓪𝓶 𝓽𝓱𝓮 𝓬𝓪𝓶𝓮𝓻𝓪 𝓽𝓱𝓪𝓽 𝓯𝓸𝓬𝓾𝓼𝓮𝓼,𝓪𝓷𝓭 𝓽𝓱𝓮 𝓹𝓻𝓸𝓽𝓪𝓰𝓸𝓷𝓲𝓼𝓽 𝓲𝓼 𝔂𝓸𝓾 𝓪𝓵𝔀𝓪𝔂𝓼 𝔂𝓸𝓾.",7966098507,枝枝吃妤-捞铁版,https://weibo.com/u/7966098507,,阅尽好花千万树 愿君记取此一枝,其他,f,17,39,299,"6,861","62,410",713,"69,984"
29,5154192017855009,5796516407,2025-04-12 10:05:38,凭你的样子描绘爱  ꒰ᐡ &gt;  ̫ o̴̶̷̤ ᐡ꒱,来自广东,5154548272859850,0,0,凭你的样子描绘爱  ꒰ᐡ >  ̫ o̴̶̷̤ ᐡ꒱,7937652045,初识你叫鞠婧祎丨专祎版,https://weibo.com/u/7937652045,,,其他,f,2,6,5,2,0,0,2
30,5154192017855009,5796516407,2025-04-12 08:05:27,&quot;如果花吹到了你的耳畔那你可知我是在诉说爱&quot;,来自广西,5154518032450102,0,0,"""如果花吹到了你的耳畔那你可知我是在诉说爱""",7966118870,猫猫愿望,https://weibo.com/u/7966118870,,,其他,f,8,21,9,12,2,3,17
31,5154192017855009,5796516407,2025-04-12 07:40:14,"“见面时 我们的呐喊声定能响彻整片海” &quot;𝑾𝒉𝒆𝒏 𝒘𝒆 𝒎𝒆𝒆𝒕, 𝒐𝒖𝒓 𝒔𝒉𝒐𝒖𝒕𝒔 𝒘𝒊𝒍𝒍 𝒓𝒆𝒔𝒐𝒖𝒏𝒅 𝒕𝒉𝒓𝒐𝒖𝒈𝒉 𝒕𝒉𝒆 𝒔𝒆𝒂.&quot;",来自广西,5154511686730078,0,0,"“见面时 我们的呐喊声定能响彻整片海” ""𝑾𝒉𝒆𝒏 𝒘𝒆 𝒎𝒆𝒆𝒕, 𝒐𝒖𝒓 𝒔𝒉𝒐𝒖𝒕𝒔 𝒘𝒊𝒍𝒍 𝒓𝒆𝒔𝒐𝒖𝒏𝒅 𝒕𝒉𝒓𝒐𝒖𝒈𝒉 𝒕𝒉𝒆 𝒔𝒆𝒂.""",7948796470,加点zuo酱-,https://weibo.com/u/7948796470,,,其他,f,5,34,2597,983,201,203,"1,387"
32,5154192017855009,5796516407,2025-04-12 01:13:08,🦋抬起头面向阳光，哪里都是希望𝐑𝐚𝐢𝐬𝐞 𝐲𝐨𝐮𝐫 𝐡𝐞𝐚𝐝 𝐚𝐧𝐝 𝐟𝐚𝐜𝐞 𝐭𝐡𝐞 𝐬𝐮𝐧. 𝐓𝐡𝐞𝐫𝐞 𝐢𝐬 𝐡𝐨𝐩𝐞 𝐞𝐯𝐞𝐫𝐲𝐰𝐡𝐞𝐫.,来自福建,5154414265896020,0,0,🦋抬起头面向阳光，哪里都是希望𝐑𝐚𝐢𝐬𝐞 𝐲𝐨𝐮𝐫 𝐡𝐞𝐚𝐝 𝐚𝐧𝐝 𝐟𝐚𝐜𝐞 𝐭𝐡𝐞 𝐬𝐮𝐧. 𝐓𝐡𝐞𝐫𝐞 𝐢𝐬 𝐡𝐨𝐩𝐞 𝐞𝐯𝐞𝐫𝐲𝐰𝐡𝐞𝐫.,7948727665,桃桃果酱糕,https://weibo.com/u/7948727665,,捞贴号1,其他,f,11,28,134,41,71,13,125
33,5154192017855009,5796516407,2025-04-11 14:49:45,想把天上的星星摘给你，却发现它们早就在你的眼睛里。 ​​,来自安徽,5154257385033682,0,0,想把天上的星星摘给你，却发现它们早就在你的眼睛里。 ​​,7818638173,耳朵兔兔鲨狼5,https://weibo.com/u/7818638173,,聪慧圆滑，不走常路，是为独具匠心。,其他,f,1326,1377,57119,"18,241","360,060",339,"378,640"
34,5154192017855009,5796516407,2025-04-11 14:15:29,“白鸽脱离了白昼，黑暗世界的光是被诋毁的玫瑰 你是永恒的救赎”,来自山西,5154248761805094,0,0,“白鸽脱离了白昼，黑暗世界的光是被诋毁的玫瑰 你是永恒的救赎”,7948952954,-要开心啊-x,https://weibo.com/u/7948952954,,缓慢而坚定地成长，温柔有力量地生活。,山西 临汾,f,7,39,37,30,0,4,34
35,5154192017855009,5796516407,2025-04-11 12:45:00,“愿今夏汇聚点点萤火微光，为你照亮前路，划破漫漫长夜”,来自四川,5154225990667085,0,0,“愿今夏汇聚点点萤火微光，为你照亮前路，划破漫漫长夜”,7959821193,绿翊盎然,https://weibo.com/u/7959821193,,周而复始 翊然热爱,其他,f,510,12,458,249,34,107,390
36,5154192017855009,5796516407,2025-04-12 01:11:04,“玫瑰肆意的拥抱万物，绽放于四季” &quot;𝓡𝓸𝓼𝓮𝓼 𝓮𝓶𝓫𝓻𝓪𝓬𝓮 𝓪𝓵𝓵 𝓽𝓱𝓲𝓷𝓰𝓼 𝔀𝓪𝓷𝓽𝓸𝓷𝓵𝔂 𝓪𝓷𝓭 𝓫𝓵𝓸𝓼𝓼,来自福建,5154413745015155,0,0,"“玫瑰肆意的拥抱万物，绽放于四季” ""𝓡𝓸𝓼𝓮𝓼 𝓮𝓶𝓫𝓻𝓪𝓬𝓮 𝓪𝓵𝓵 𝓽𝓱𝓲𝓷𝓰𝓼 𝔀𝓪𝓷𝓽𝓸𝓷𝓵𝔂 𝓪𝓷𝓭 𝓫𝓵𝓸𝓼𝓼",7618352509,Han璃,https://weibo.com/u/7618352509,,镇魂时代少年团永远在一起,上海 宝山区,f,45,152,1181,"1,095",46,215,"1,356"
37,5154192017855009,5796516407,2025-04-11 22:02:22,人生路上，要学会善待，善待他人，可以让人生走得更远；善待自己，可以让生命活得滋润。无论是善待谁，其实都是温暖在流转，都是爱在延宕，最终，施及别人，惠泽自身。,来自江西,5154366260511955,0,0,人生路上，要学会善待，善待他人，可以让人生走得更远；善待自己，可以让生命活得滋润。无论是善待谁，其实都是温暖在流转，都是爱在延宕，最终，施及别人，惠泽自身。,7991994190,病娇小姐_1,https://weibo.com/u/7991994190,,碗盆,其他,f,1,9,1,0,0,0,0
38,5154192017855009,5796516407,2025-04-11 21:56:43,感谢分享,来自上海,5154364834972704,0,0,感谢分享,7546280248,筱欣1218,https://weibo.com/u/7546280248,,虞书欣 贴没有捞完就是pf了,上海 奉贤区,f,254,364,817,"17,714",54,"2,717","20,485"
39,5154192017855009,5796516407,2025-04-11 21:47:02,人生路上，要学会善待，善待他人，可以让人生走得更远；善待自己，可以让生命活得滋润。无论是善待谁，其实都是温暖在流转，都是爱在延宕，最终，施及别人，惠泽自身。,来自江西,5154362399132570,0,0,人生路上，要学会善待，善待他人，可以让人生走得更远；善待自己，可以让生命活得滋润。无论是善待谁，其实都是温暖在流转，都是爱在延宕，最终，施及别人，惠泽自身。,7927160444,ID碗狗牙貓,https://weibo.com/u/7927160444,超话粉丝钻咖（文轩超话）,清纯甜妹 cos病娇小姐. 碗盆 -lywsyxlylwx-,江西 赣州,f,779,300,878,"18,413",93,"3,216","21,722"
40,5154192017855009,5796516407,2025-04-11 19:45:09,“玫瑰在海里燃烧 我的爱在烈火中绽放.” ＂𝓡𝓸𝓼𝓮𝓼 𝓫𝓾𝓻𝓷 𝓲𝓷 𝓽𝓱𝓮 𝓼𝓮𝓪 𝓪𝓷𝓭 𝓶𝔂 𝓵𝓸𝓿𝓮 𝓫𝓵𝓸𝓸𝓶𝓼 𝓲𝓷,来自江西,5154331725662186,0,0,“玫瑰在海里燃烧 我的爱在烈火中绽放.” ＂𝓡𝓸𝓼𝓮𝓼 𝓫𝓾𝓻𝓷 𝓲𝓷 𝓽𝓱𝓮 𝓼𝓮𝓪 𝓪𝓷𝓭 𝓶𝔂 𝓵𝓸𝓿𝓮 𝓫𝓵𝓸𝓸𝓶𝓼 𝓲𝓷,6018287103,遇祎见椿yi,https://weibo.com/u/6018287103,,“ 长安双邪 没听说过吗？”,云南,f,339,479,646,"10,198",80,"1,180","11,458"
41,5154192017855009,5796516407,2025-04-11 17:07:13,我们生在红旗下，长在春风里。人民有信仰，国家有力量。目光所致皆为华夏，五星闪耀皆为信仰。,来自吉林,5154291979392163,0,0,我们生在红旗下，长在春风里。人民有信仰，国家有力量。目光所致皆为华夏，五星闪耀皆为信仰。,7470612733,Tloml_mi,https://weibo.com/u/7470612733,超话粉丝大咖（金晨超话） 超话粉丝大咖（宋茜超话）,🌧️,吉林 四平,f,821,550,2085,"16,670",309,"9,026","26,005"
42,5154192017855009,5796516407,2025-04-11 12:58:00,感谢分享,来自山西,5154229266678507,0,0,感谢分享,5842350586,Eternal_記奕屿凡苳,https://weibo.com/u/5842350586,,🔝黄子弘凡 陈奕恒  🈲单曲 续🔥可私,山西 晋中,f,389,513,2254,"14,325",44,"2,335","16,704"
43,5154192017855009,5796516407,2025-04-11 12:52:48,“你一定要站在你所热爱的世界里闪闪发光”𝓨𝓸𝓾𝓶𝓾𝓼𝓽 𝓼𝓽𝓪𝓷𝓭 𝓪𝓷𝓭 𝓼𝓱𝓲𝓷𝓮 𝓲𝓷 𝓽𝓱𝓮 𝔀𝓸𝓻𝓵𝓭 𝔂𝓸𝓾 𝓵𝓸𝓿𝓮,来自福建,5154227953862029,0,0,“你一定要站在你所热爱的世界里闪闪发光”𝓨𝓸𝓾𝓶𝓾𝓼𝓽 𝓼𝓽𝓪𝓷𝓭 𝓪𝓷𝓭 𝓼𝓱𝓲𝓷𝓮 𝓲𝓷 𝓽𝓱𝓮 𝔀𝓸𝓻𝓵𝓭 𝔂𝓸𝓾 𝓵𝓸𝓿𝓮,7560511456,麦颖幂,https://weibo.com/u/7560511456,,主页挂杨幂🦊,福建,f,156,165,778,"4,585",61,"1,721","6,367"
44,5154192017855009,5796516407,2025-04-11 12:17:57,“我把我们的故事写成书锁住仅有的回忆”,来自广西,5154219188552609,0,0,“我把我们的故事写成书锁住仅有的回忆”,7959123677,a是祈裕露,https://weibo.com/u/7959123677,,赵露思,其他,f,79,151,519,"1,238","1,642",283,"3,163"
