,comments_level_1_mid,main_body_uid,发布时间,处理内容,评论地点,mid,点赞数量,原生内容,uid,用户昵称,用户主页,用户认证信息,用户描述,用户地理位置,用户性别,用户粉丝数量,用户关注数量,用户全部微博,用户累计评论,用户累计转发,用户累计获赞,用户转评赞
0,5153992028459794,5574407334,25年04月10日 21:22,赵冬苓把结尾设置得也很狡黠，我记得一条弹幕，说如果孙彩云和刘莹莹不自首，她们甚至连监狱都不用蹲hhh，一个女人成活的世界,来自内蒙古,5153993928213521,14,赵冬苓把结尾设置得也很狡黠，我记得一条弹幕，说如果孙彩云和刘莹莹不自首，她们甚至连监狱都不用蹲hhh，一个女人成活的世界,5574407334,空空两对半,https://weibo.com/u/5574407334,电影博主,新浪网友,其他,f,343603,182,8067,"277,717","1,361,013","6,457,882","8,096,612"
1,5153992028459794,5574407334,25年04月10日 21:28,"最后被抓走还说:“我还给你们提供线索了呢~”哈哈哈哈哈哈哈哈哈哈哈哈哈哈哈哈哈哈哈哈哈哈哈超强心态，干什么都会成功的！<img alt=""[加油]"" title=""[加油]"" src=""https://face.t.sinajs.cn/t4/appstyle/expression/ext/normal/9f/2018new_jiayou_org.png"" />",来自黑龙江,5153995304207061,9,最后被抓走还说:“我还给你们提供线索了呢~”哈哈哈哈哈哈哈哈哈哈哈哈哈哈哈哈哈哈哈哈哈哈哈超强心态，干什么都会成功的！[加油],5508701677,名字被占用的哥哥女友,https://weibo.com/u/5508701677,,拥有万里墙头拼命靠追星获得快乐的人,黑龙江,f,518,4677,44552,"15,065","20,286","44,330","79,681"
2,5153992028459794,5574407334,25年04月13日 14:05,"最后还惦记着遗产继承，最坚挺的搞钱人设<img alt=""[奥特曼]"" title=""[奥特曼]"" src=""https://face.t.sinajs.cn/t4/appstyle/expression/ext/normal/c6/2018new_aoteman_org.png"" />",来自北京,5154971030651735,3,最后还惦记着遗产继承，最坚挺的搞钱人设[奥特曼],6140297211,草莓劫匪,https://weibo.com/u/6140297211,,最近是动森懒人,其他,f,59,832,85,2,0,1,3
3,5153992028459794,5574407334,25年04月10日 21:33,"回复<a href=/n/凯心一笑我就笑 usercard=""name=@凯心一笑我就笑"">@凯心一笑我就笑</a>:而且做选择做得巨快，每个选择哪怕心里可能没太大把握都自信又自洽地完成得很好！！！吾辈楷模",来自黑龙江,5153996541003717,2,回复@凯心一笑我就笑:而且做选择做得巨快，每个选择哪怕心里可能没太大把握都自信又自洽地完成得很好！！！吾辈楷模,5508701677,名字被占用的哥哥女友,https://weibo.com/u/5508701677,,拥有万里墙头拼命靠追星获得快乐的人,黑龙江,f,518,4677,44552,"15,065","20,286","44,330","79,681"
4,5153992028459794,5574407334,25年04月10日 21:31,"回复<a href=/n/名字被占用的哥哥女友 usercard=""name=@名字被占用的哥哥女友"">@名字被占用的哥哥女友</a>:而且永远能权衡利弊，做出选择，调转不利于自己的境地<img alt=""[赞]"" title=""[赞]"" src=""https://face.t.sinajs.cn/t4/appstyle/expression/ext/normal/e6/2018new_zan_org.png"" />",来自江苏,5153996218045603,5,回复@名字被占用的哥哥女友:而且永远能权衡利弊，做出选择，调转不利于自己的境地[赞],2749095437,凯心一笑我就笑,https://weibo.com/u/2749095437,,撕逼撩架不约,北京 朝阳区,f,1182,338,43153,"8,033","10,290","4,563","22,886"
5,5153992028459794,5574407334,25年04月10日 21:25,"回复<a href=/n/空空两对半 usercard=""name=@空空两对半"">@空空两对半</a>:的确<img alt=""[偷乐]"" title=""[偷乐]"" src=""https://face.t.sinajs.cn/t4/appstyle/expression/ext/normal/fa/lxhtouxiao_thumb.gif"" />",来自江苏,5153994562602877,0,回复@空空两对半:的确[偷乐],2749095437,凯心一笑我就笑,https://weibo.com/u/2749095437,,撕逼撩架不约,北京 朝阳区,f,1182,338,43153,"8,033","10,290","4,563","22,886"
